Name,ID,number of warnings,Reason,Date (YYYY-MM-DD),Expiry - 60 / ∞ / ∅
sans.,277615953926291457,,Persisted with typing quirks after being rolebanned for them.,2020-05-06,
Baby Palu,460464412411822080,,"roleplaying as a baby in newhome, with added spoiler abuse",2020-05-07,
space knight 9000,367057993566519297,,N-word in chat.,2020-05-07,
D_Mo08,543832307614613504,,random images and memes outside of trashcan,2020-05-07,
ThatWeirdOne,453382406666321930,,Hoisting self after being told not to,2020-05-09,
Canadian_Dog,573657042963922982,,talking about raiding other servers in vc,2020-05-10,
Canadian_dog,573657042963922982,,spamming the same images 3 times in trashcan,2020-05-12,
DragonGoddess102,670484689143857165,,Spamming some unfunny copypasta with a fuckton of cancerous unicode symbols in trashcan,2020-05-12,
MW-the man behind slaughter,691324134885556244,,continuing to post in other languages after being told to stop,2020-05-12,
SNANS,708064205512769578,,Repeated derails when told to stop by staff,2020-05-13,
swifftysans,645424707545595934,,Randomly yelling and talking about killing themselves.,2020-05-13,
Shinko,364439484441296898,,silent in roleban after saying things only in Russian.,2020-05-13,
kitten,703051458827780098,,Using an alt with ID 709975134840029218.,2020-05-13,
kitten,703051458827780098,,Server shilling.,2020-05-13,
Big Krunkus,684557037107019787,,Fetish posting in newhome,2020-05-14,
TommyCreeper002,703676552361148436,,posting wall of text,2020-05-14,
History Recast Frisk,549828704398999560,,"link spam, unresponsive in roleban",2020-05-15,
MW-SANESS,565189687715823666,,trolling,2020-05-15,
goffXD,568206345359327253,,slur in avy,2020-05-15,
depressed boi/mister wanna die,541024215156129802,,Noncompliant with staff requests to change username and pfp,2020-05-16,
Gealbendy,710868582023823412,,"Scribbl.io spam in multiple languages, no response in jug.",2020-05-16,
Ardseii,198758697588097024,,Sexual harassment.,2020-05-17,
redymedy,696417223212007475,,Derailling,2020-05-17,
IMMORTAL-MIKU,333795355118403586,,Stating intent to commit suicide in Newhome,2020-05-17,
Lover gd,703109836505874533,,server shilling in newhome.,2020-05-17,
baquita marina,691337627210743850,,lewd ascii art faces,2020-05-17,
that_one_loli,506858133298085890,,"slur in newhome, questionable nickname, unresponsive in roleban",2020-05-19,
eismen38,442044605731569685,,Shilling a youtube video in multiple channels.,2020-05-19,
bipolar,683133727278235728,,"Unicode spam, kept complaining that the spam wasn't spam when told to stop.",2020-05-19,
bipolar,683133727278235728,,Really desperate to die on the hill that netted them the previous warning in roleban.,2020-05-19,
Sovyet Barış,561880999701512192,,spamming and not understanding english.,2020-05-19,
Palu Creepertoon,460464412411822080,,"Random hugging and kissing to users, RPing in public when told to stop",2020-05-20,
coolskeleton95,634174865708154911,,Roleplaying in incorrect channels,2020-05-20,
PAAAPA,658729691603009536,,Multiple attempts at server advertisement.,2020-05-20,Permanent ∞
Fresh boi,667559840301711370,,spamming ok,2020-05-21,
xXszychaXx,693545726143365130,,random emoji after being told to stop,2020-05-22,
Merciful,403283021001654292,,random emoji after being told to stop,2020-05-22,
ItsHoiTime,558471083272044545,,random emoji after being told to stop,2020-05-22,
xXszychaXx,693545726143365130,,"ded chat 2 minutes after I told off someone for doing it, in almost precisely the same words.",2020-05-22,
xXszychaXx,693545726143365130,,Server advertising immediately before their last roleban but I didn't notice until immediately after I untossed them.,2020-05-22,
Walter White,594959378193317889,,NSFW posts in trashcan,2020-05-23,
Walter White,594959378193317889,,Fucking about in roleban,2020-05-23,
youngbuck9207#4457,645114579147554843,,"loud noise in vc, DM'd me to un-servermute, no-context link in newhome, unresponsive to rules, unresponsive in roleban",2020-05-24,
Mohammed_techsupport,283381313178828801,,Everyone ping to shill their gofundme.,2020-05-24,
azAZ09,686152289597259841,,"Emoji spam, attempted bot exploitation",2020-05-24,
Nintendo Switch  Mario,684894558995480635,,Racist meme,2020-05-24,
Leathergnome,521744506446675977,,Trying to argue that another user's spamming wasnt spam,2020-05-25,
yellowfruit,714096737886928987,,Trying to argue that another user's spamming wasn't spam,2020-05-25,
hsonaboss123,713180931137077340,,Sending random invites and voice calls in DMs,2020-05-25,
Neceptus,695040901373886586,,"Navy seal copypasta, wouldn't take jug seriously",2020-05-27,
iwillprobablyhugyou,715257139844612127,,school shooting jokes and disturbing disregard for family safety,2020-05-29,
sir this is a wendys drivethru,655644463309520896,,Racist r/GoCommitDie memes,2020-05-29,
NGTV1234,331437106075402251,,posted a discord invite in 2018,2020-05-30,
~♡Swap Chara♡~,697093843241271308,,Continued to speak Russian in an English-only server,2020-05-30,
Ralsei,716420952275288145,,Complaining about the fact they were muted from the VC,2020-05-31,
Pending_ERROR#1669,714598707282313256,,"talking in wingding, no response in roleban",2020-05-31,
mommy.exe,482760632098095132,,hitler meme + non-covid related meme in covid-memes,2020-06-01,
💜💌Jadou-Chan💌💜#5449,588643002201800735,,Not citing art references,2020-06-01,
Gumball#8421,602880828934062110,,bragged about having undertale for free and immediately left,2020-06-02,
oofer and oofest,696913831787495444,,"Didn't take casual discussion to the general channels, blew up in art-share",2020-06-03,
𝕯𝖊𝖛𝖎𝖑•𝖓𝖚𝖒𝖆𝖆𝖓,628519900402679828,,using art assets without credit,2020-06-03,
its meeeeeeee,701006009388236832,,likes to spam sometimes,2020-06-03,
Bluips,482261769906290698,,nsfw pfp on join,2020-06-03,
Piss Boy,717808622461124648,,using inappropriate pfps,2020-06-03,
[REDACTED],564540033646985216,,spamming,2020-06-03,
Ms. Chalice,668287376266887177,,Contextless images in <#120330239996854274>,2020-06-03,
KAMOelite (Smelly Crime Boy),615379507427278858,,shilling,2020-06-04,
Sans,563753460424638465,,Harassment of other users,2020-06-04,
billymanting,547413631994953738,,Roleplaying after being told to stop in newhome,2020-06-04,
?.Daddy gaster.,391477230582366219,,kinky trees in <#120330239996854274> ,2020-06-04,
marc,714100963002155068,,Posting random emojis after being told to stop shitposting in musicbox,2020-06-06,
skelebro,703607174210912347,,Invite spam,2020-06-07,
original gasterblaster,715415146633232415,,continuing to roleplay after being told to stop,2020-06-08,
Sonic The Hedgehog,620297434110623764,,Shitposting in the general chat and in <#616700765054042112>.,2020-06-08,
BlackBeam,665497751009886218,,emote spam,2020-06-08,
Y_Gkoutz,639177672857092125,,"Emoji spam, did it after being told to stop by staff and explaining to another user what it was exactly they were to stop doing",2020-06-08,permanent ∞
Clouds10 11,717943512859017217,,posting vore,2020-06-08,
Ace_The_Skeleton,565793368655790090,,Antisemetic memes,2020-06-09,
Xero,337921246341758977,,autism jokes,2020-06-09,
W.D Gaster,717447402012803113,,posting in windings after being told it wasn't allowed,2020-06-09,
Logs_Maker,714841680070705313,,"suspicious messages in newhome and roleban, probably lying about being hacked",2020-06-10,
Aut-O-Mizer,716062523782070303,,came into newhome specifically to troll,2020-06-10,
its meeeeeeee,701006009388236832,,copypasta spam,2020-06-10,
INK Санс,684049253860900909,,likes to talk in russian a lot,2020-06-10,
DKTALEs,624695706661289995,,talking in russian,2020-06-10,
Bacon_eggs24,716114152141095013,,Spamming despite multiple complaints,2020-06-10,
Chancy,365590787884580864,,Suicide video in <#324642291044057099>,2020-06-11,
Spaceboy,600287781620678665,,Laser girl meme in trashcan,2020-06-11,
Awesome Aden24,707269048026660985,,multiple server invite attempts,2020-06-11,
happy snas,523845427267633152,,DM'ing server invites.,2020-06-12,
Deku,487034070333653002,,Not crediting art sources,2020-06-12,
Pharaoh Tobin⸻⸻⸻⸻⸻⸻⸻⸻⸻⸻⸻⸻⸻⸻⸻⸻⸻⸻⸻,249494803811663873,,Repeatedly posting sensitive content,2020-06-12,
i h8 bred how abot you,689990609133764674,,Saying creepy things about women in trashcan,2020-06-13,
Papyrus,710861113398395021,,multiple server invite attempts,2020-06-13,
walter,714541445360648244,,Uncooperative in roleban,2020-06-14,
Mr.Squid,689463553542848582,,Suicide memes in <#120330239996854274> ,2020-06-15,
Chara,713120044229328906,,Refused to stop roleplaying in newhome when asked to stop.,2020-06-15,
the glow feline,684794431811223639,,"Repeatedly begging for free art, including after being told to stop by staff",2020-06-15,
francy,560569904089137182,,Somehow managed to post a link to Bad dragon in newhome,2020-06-16,
LyonWGF,705799897223397467,,"everyone ping, attempted roleban evasion",2020-06-16,
Quote,722574940142043247,,derailing,2020-06-17,
Phillbuster,721142279573602407,,Asking to be rolebanned,2020-06-17,
dodi1004,337222856725364747,,ear rape,2020-06-18,
tangy,108361918044987392,,"Chucking a massive shitfit over us adding mods, kept going after being told to stop by staff",2020-06-18,
$olboss,716043686999228427,,Posting cropped sans x papyrus porn in artshare.,2020-06-18,
DOOTARO DUTOO,720592729683525662,,"Continues making crude jokes about the n-word and about tragic personal matters, continues being incoherent in VC despite being told to stop",2020-06-18,
Big Krunkus,684557037107019787,,Accidental NSFW,2020-06-18,
Captain BIRB,691598280852766752,,posting a liveleak video meme in trashcan,2020-06-18,
aDotInSpace,289878682120617985,,Continued disrespect towards the trial mods.,2020-06-19,
codplay,332679014948798469,,NSFW meme in <#324642291044057099>,2020-06-19,
Snoips,209004560684023808,,Requested link to pirated copy of Undertale,2020-06-20,
Alfreed,685387624726134793,,Continued abuse of a bug in Flowey's quickdelete function.,2020-06-20,
JP21,556110554432012308,,"Being needlessly toxic in newhome, arguing with moderators. Transferred from earlier account",2017-04-24,
JP21,556110554432012308,,"Threats agaist a user, defiance of moderators. Transferred from earlier account",2017-04-25,
JP21,556110554432012308,,Announcing she's leaving in protest literally a minute after being told not to. Transferred from earlier account,2018-03-14,
JP21,556110554432012308,,Refusing to cooperate in a channel. Transferred from earlier account.,2018-04-27,
Alishosho,450688875946442752,,Mass pinging users.,2020-06-20,
Fishy Reid,703810612307951656,,First message was a gif trying to induce seizures in people with epilepsy.,2020-06-21,
im a human yeeeee,502754461593370625,,Continued use of emojis out of context after being told multiple times not to.,2020-06-22,
ANGELO,518106027019993120,,Slurs in VC.,2020-06-25,
Pakiy,285468689493655554,,Slurs in VC.,2020-06-25,
!【𝓓ᖇ】R̸̄͝ṑ̶y̶͋ C̵h̵i̶ń̶̕o̷ ツ,698060549354684467,,Two NSFW memes in the span of 5 minutes.,2020-06-27,
Albertt0ast,726904319139512351,,posted a random meme in response to being told to post random memes in trashcan,2020-06-29,
Maurice,459206232566398981,,spam,2020-06-29,
Let that sink in,421457175181787136,,"mistaken shitpost in newhome, allegedly. fishy explanation in roleban",2020-06-29,
WhimpyPoo,725469294712061992,,unsolicited invites,2020-06-30,
Jotaro,683360487240368149,,Jotaro spam,2020-06-30,
hotshot,727224722777178202,,NSFW comments.,2020-06-30,
hotshot,727224722777178202,,Treating roleban with contempt,2020-06-30,
Grigorescu=-=,701705618045534248,,Continuing speaking in foreign languages and insulting people in them even after being told to stop.,2020-06-30,
mohammed advil,532331617734361098,,Wouldn't stop asking for cardboard when told to stop,2020-06-30,
UGANDA SANIC,714781460061487135,,Spamming.,2020-06-30,
JOJO,726147456970260593,,Purposely evading server mutes.,2020-06-30,
Zeke,723669739146313739,,shilling,2020-07-01,
XCross SansX,727413381941821481,,Posting .exe files even after being told to stop.,2020-07-01,
illuminaek,290117851657011201,,autism insult post,2020-07-02,
Mr. Blue,210434805664317440,,i do bitch,2020-07-03,
homer gamer,662427381088256017,,"Vapid spam, continued in roleban.",2020-07-05,
im Weird,729670114945007686,,"Rolebanned for a minor offense, made up a ridiculous lie to get out of it.",2020-07-06,
⋟ TORIEL,718757803547688991,,Attention-seeking drama queen,2020-07-06,
Jeff the Killer,722326189867532370,,"Posted art without credit and left (but didn't say ""I drew this"")",2020-07-06,
ISU-152-1,609405761273069568,,Racist meme.,2020-07-06,
mmrn,708473428184793088,,Venting and yelling I DON'T LIKE YOU at people,2020-07-07,
Pikachu,673000750519156744,,Posting bob/memecat copypastas,2020-07-07,
Duck,718181839411609610,,Sans did 9/11 joke in <#507736422556631040>,2020-07-07,
💎✨kyri_tuga✨💎,628208923345682463,,Posted ascii art right after being told not to.,2020-07-07,
Jotaro Kujo,712419367832518748,,Spurting derailing and vapid nonsense in the middle of conversations.,2020-07-08,
Mr.Squid,689463553542848582,,Fetishy comment in <#120330239996854274> about shoving live animals up his rectum.,2020-07-09,
jobyjem,392853383892959232,,Sassing Moderator,2020-07-10,
Shrek,620295936349962303,,"Spam, shitposts outside of trashcan, begging others for the UT soundtrack",2020-07-11,
Megalovania Jedi,490608900714921989,,Petty behaviour when asked to source art in <#148960889540837376>,2020-07-11,
Meme Machine,604003091741933588,,"r-slur in name, big image wall in artshare, said image wall contained references to NSFW activity",2020-07-14,
sans,716525257501966357,,Posting 'yeet' in several channels,2020-07-14,
The Nugget Artist,727422390942040075,,Derailing in newhome repeatedly,2020-07-14,
Spirgis,423106905326485505,,Told me to shut the fuck up via a meme in the wrong channel when asked to stop spamming.,2020-07-14,
QLS|Cacadipo,617083702081486849,,Ascii art even after being told not to post it.,2020-07-14,
THICC SHAGGY,654406462843519007,,Shitposting outside of trashcan,2020-07-15,
lord_catten,732390158917173339,,Screaming in VC.,2020-07-15,
IMMORTAL-MIKU,333795355118403586,,Consistently derailing conversations and consistently bringing up NSFW topics.,2020-07-16,Permanent ∞
Kingconnor39,552544926634737724,,Posted an absurdly racist meme.,2020-07-17,
JgAmER,731648904969322518,,dm ads,2020-07-17,
maomao gaming (idk edition),723977031519567884,,"Keeps saying they're bored every time they're rolebanned, uncooperative.",2020-07-18,
Aut-O-Mizer,732406354425413704,,Being deliberately toxic 'for fun'.,2020-07-19,
IᶰSᶦᵐᵖᶫᵉTᵉʳᵐˢJᵒʳᵈᵃᶰ,255882669991133184,,Kept an argument about the semantics of priacy and how streaming services restrict their creators going against everyone else's wishes,2020-07-19,
Glittchy The Glitch,678048115466567680,,NSFW memes.,2020-07-20,
X Mug,622847696214032423,,Slurs in video meme,2020-07-20,
skelestan,732953125299814442,,"Spam in newhome, claims ignorance of rules in defence.",2020-07-21,
blaze,585112951590092800,,Stirring up drama in <#324642291044057099>,2020-07-21,
Noxro_Dark,700829325087342663,,Pinging everyone after being told not to.,2020-07-22,
Aut-O-Mizer,732406354425413704,,"Constantly bringing up drama, to the point of trying to extend a roleban into newhome.",2020-07-22,
*•.¸♡ ʙᴇᴛᴇ ɴᴏɪʀᴇ ♡¸.•*,485855027802537991,,"posting a link to a granny porn site, then deleting it",2020-07-22,
vibro cantalejo,599824655401877527,,continued to post random emojis when told to stop,2020-07-22,
elliot,730502342918668290,,shilling their server,2020-07-22,
vibro cantalejo,599824655401877527,,advertising their server,2020-07-22,
EnderBrah,507595609436586002,,"Spam, failing to follow staff instructions",2020-07-22,
Noxro_Dark,700829325087342663,,Minimodding.,2020-07-22,
LGZ,361170818056847360,,Immediately earraped VC.,2020-07-22,
Glitchelon,730458597636702219,,emote spam,2020-07-22,
bigboispaghet,695974043030913037,,"Harassing a user, minimodding",2020-07-23,
Kris Dreemurr,728953656178769931,,"Failed to read chat, barged right in and said 'hello' like 6 times in 5 seconds.",2020-07-23,
NoFaceRen,516404965422399491,,Continually hoisting themselves even after being told not to multiple times.,2020-07-24,
0000000,516404965422399491,,Continuing to hoist self even after being given a warning.,2020-07-24,
MrPMyeeter,703995092452769853,,Spam on join,2020-07-24,
XenonEquinox__,725707905084424302,,Won't stop saying 'I like Sans' an absurd amount of times a day even after being told not to.,2020-07-24,
cursed man,483346293192916993,,racist meme,2020-07-24,
Citrus Sinensis,688377302639181826,,9/11 joke,2020-07-25,
SPICYBOI,708207695924297820,,shitpost in newhome after being told to take it to trashcan,2020-07-26,
Error sans,663565268148027401,,Slur in image because they 'didn't read the rules'.,2020-07-28,
RUNNIN,584464335418425426,,Noncompliant with the requests of staff,2020-07-28,
PheonixTheBox,700401088842694737,,Continuous use of Wingdings.,2020-07-30,
Sonicslayer12,738354049505689751,,micspam,2020-07-30,
Coolguy7755,737511815323451454,,Posting a scam link + server invite.,2020-07-31,
lucky03,739016601055133759,,"Trolling, baiting, and being uncooperative in roleban.",2020-08-02,
Mike Wazowski,732999302900744192,,"Disruptive behaviour in <#120330239996854274>, refused to take roleban seriously",2020-08-02,
pog,525477498822328330,,Derailling an actual conversation to talk about their piracy in newhome.,2020-08-02,
sarah,82303438955753472,,Ahegao in trashcan,2020-08-02,
pog,525477498822328330,,Posted meme with implied rape to Trashcan. Spamming memes repeatedly.,2020-08-02,
Mighty Chuck,335686105456312321,,Permanent warning for unban.,2020-08-02,
Postrockplays,735157279388598282,,Earraping VC 'for a dare'.,2020-08-02,
khaiworld,732244470971498617,,DMing multiple people unsolicited ads.,2020-08-03,
smolyoshino 💚,193789388034015232,,Appeal accepted.,2020-08-04,
michiru/shirou,729766049188282398,,shilled in DMs,2020-08-04,
cyandieslight,614531369779068939,,posting racist meme,2020-08-05,
Grumpy Cat.,726141576325103737,,Spam and derailed after being told to stop by staff,2020-08-05,
CatQueen,692137200854499429,,Polish in English-only server. derailing in VC,2020-08-05,
~ 𝒜𝓈𝓇𝒾𝑒𝓁 𝒟𝓇𝑒𝑒𝓂𝓊𝓇𝓇 ~,696003129485033562,,repeated server ads,2020-08-05,
DaPoopGoBruh,741471239452754030,,Nazi image.,2020-08-08,
NotAJevil,740474724215291914,,Everyone ping,2020-08-08,
Timofey,735812891604942869,,Might speak in russian in the VCs if he feels like it.,2020-08-08,
NootmareToast,720823383167729713,,Emoji spam,2020-08-08,
NootmareToast,720823383167729713,,More emoji spam,2020-08-08,
Cosmo ✌🏻,736861323924602921,,"Derailling, drama",2020-08-08,
Cosmo ✌🏻,736861323924602921,,"More drama in roleban, wouldn't calm down",2020-08-08,
Timofey,735812891604942869,,Smartass response when told to speak English,2020-08-09,
Paragon of Insinuation,529068559339487232,,Inflammatory/toxic behaviour/minimodding after being told to stop by staff.,2020-08-10,
Kamikaze,729107945228468224,,"NSFW twitter post in newhome, smartass when told to stop",2020-08-10,
Kamikaze,729107945228468224,,Emoji spam,2020-08-10,
levy yamamoto,575411381277425691,,Abuse of an exploit in YBF's delete police function.,2020-08-11,
sovazoo,367865706596925442,,Posting Miraculous Ladybug in a suggestive pose since it's funny that it exists,2020-08-11,
GASTER,635487322552401924,,Inappropriate comments about rape when told not to RP.,2020-08-12,
Your Generic Troll,620295936349962303,,Posted a shitpost featuring a person shooting up a school full of kindergarteners for liking a video game.,2020-08-13,
ea,634179407719956511,,"Troll-like behavior, NSFW emote",2020-08-13,
chara,594372933665947658,,Memes outside trashcan immediately after vapidposting,2020-08-14,
chara,594372933665947658,,Vapid singlecharacter post as their next message,2020-08-14,permanent ∞
~That_One_Retard_Dream_Sans~,704895120838885507,,Roleplaying/derailing,2020-08-14,
yandere papyrus,744594972136833075,,Repeated memes outside trashcan,2020-08-16,
Chesse,676188548172349448,,Emoji spam,2020-08-17,
Chesse,676188548172349448,,Emoji spam after being to stop by staff,2020-08-17,permanent ∞
Katy Brown,620950536346140723,,Everyone ping in <#148960889540837376>,2020-08-17,
XxYouTubeX,515991620722622514,,"Told to cease emoji spam, put in more emojis in roleban while 'kidding'.",2020-08-17,
XxYouTubeX,515991620722622514,,Further emoji spam in roleban.,2020-08-17,
XxYouTubeX,515991620722622514,,More emojis in roleban.,2020-08-17,
dark king LaNCeR,605177857261436928,,Posted low-res copy of the bee movie in Trashcan.,2020-08-17,
Sans The Skeleton,744949858133082204,,Continued to post emojis and spam after being told to stop by staff.,2020-08-17,
penis man,588361114954366980,,Emoji spam after being asked to stop by staff,2020-08-17,
Loaisayah,727521863491780618,,server shill + attempted @ everyone ping,2020-08-17,
chunnimob,743799336076443658,,Kept pinging people after being told to stop,2020-08-17,
razen908,590640724748271643,,Join and leave spam in VC because they were 'bored'.,2020-08-21,
Charles dankin berg,723241910407397491,,Posting suggestive memes in <#324642291044057099>,2020-08-21,
doomslayer,650828832252624907,,Slurs.,2020-08-22,
﷽﷽﷽﷽﷽﷽﷽﷽﷽﷽﷽﷽﷽﷽﷽﷽﷽﷽﷽﷽﷽﷽﷽﷽﷽﷽﷽﷽﷽﷽﷽﷽,489454304835534849,,nsfw in newhome,2020-08-22,
BlueBuddy,660967440942891027,,Shitposting outside of <#324642291044057099>,2020-08-22,
Jevil,727653533511581758,,emote spam,2020-08-23,
𝓖𝓸𝓸𝓭_𝓘𝓷𝓽𝓮𝓷𝓽𝓲𝓸𝓷𝓼,723977724695150633,,ahegao thumbnail,2020-08-23,
Purple Guy,741430335912411196,,trying to blackmail staff while in roleban,2020-08-24,
funnyguy002,747287078051774515,,Rules lawyering. Rule 5 violation.,2020-08-24,
Gasty Boi,724752308579205181,,Spamming because they were bored.,2020-08-24,
Your Judgementor,705141062867484762,,Cropped porn.,2020-08-24,
WILDBAGEL,627404734688526356,,Trying to pass a blatant rip off of other people's art off as their own,2020-08-25,
Smellynuts,628354017013268503,,Posted memes outside of <#324642291044057099> after being told repeatedly not to post memes outside of <#324642291044057099>.,2020-08-26,
Smellynuts,628354017013268503,,Posted a video with suggestive/nsfw thumbnail.,2020-08-27,
jpdarkone,724373536466010234,,Vapid derails/shitposting,2020-08-27,
Smellynuts,628354017013268503,,Vapid derails/shitposting,2020-08-27,
jpdarkone,724373536466010234,,Repeated derails in newhome,2020-08-27,
unexplained,679448800644825092,,continued shitposting outside of trashcan even when told to do so,2020-08-27,
Not Tubular9,587817295825600513,,spamming invites to skibbl.io,2020-08-28,
apolo,680901571718021214,,slurs,2020-08-29,
ôoka,549673873671454720,,Slurs in <#120330239996854274>,2020-09-02,
ôoka,549673873671454720,,Fake slur bait after being warned for using slurs in newhome.,2020-09-02,
Da Pro,721106253874593793,,advertising,2020-09-03,
zzthezz5055,623233133612892162,,repeated derails with disgusting images,2020-09-04,
Liam,295775543478059010,,posted an image of someone's hair and claimed it was their vaginal bush,2020-09-04,
Lumbr,517031551553241112,,"everyone ping on join, soon left.",2020-09-05,
"Mine Gold, The Legend",667506351962062868,,emoji spam,2020-09-05,
💜🦊🖤D The Fox Girl🖤🦊💜,717155930571145238,,left server after being called out for not posting artist source,2020-09-05,
VHYDRA,705646935817584660,,everyone pings,2020-09-06,
FireFlufff,745052936727691395,,Posting random images in newhome,2020-09-06,
FireFlufff,745052936727691395,,Posted images of them threatening suicide,2020-09-07,
Henry StickMin,591366648594956306,,"posting the same video 4 times, then again when rolebanned",2020-09-08,
Adrenoy Koro,731851081713451049,,Left server after posting uncredited art,2020-09-08,
Tomm,555021419524653066,,Said to pirate Undertale 'just to see what would happen'.,2020-09-08,
Droll Magnum YT,710205071891103845,,speaking in binary and being a smart-ass when told binary and morse are not english languages,2020-09-09,
outerfrisk,699420914911150131,,"DM shilling, claimed ignorance of our rule 3.",2020-09-09,
ani🍡,256196489947250690,,"Emoji spam, persisted after being told to stop by staff",2020-09-09,permanent ∞
ani🍡,256196489947250690,,Persistant contempt when told to follow server rules.,2020-09-09,
Targon Studios,152503014215778304,,Attempted everyone ping.,2020-09-09,
Targon Studios,152503014215778304,,"Poor behaviour in roleban, made a big deal out of being unwilling to follow conversations before barging into them.",2020-09-09,
runa,687016205923778591,,"Inappropriate joke, argued it in roleban.",2020-09-09,
SirQcumber,421813295255781377,,repeatedly called people simps after being told to stop,2020-09-09,
sans.,750480190584651789,,RP as sans in a non-RP server,2020-09-09,
ghost of nelem,660755320003493898,,"Sent a vapid message in <#148960889540837376>, told them to keep it art related, threw a fit and not only clogged up art-share after being told to stop but continued to argue in <#616700765054042112>.",2020-09-10,
JESTER,623186605821263872,,“Spam.”,2020-09-10,
Pharaoh Tobin⸻⸻⸻⸻⸻⸻⸻⸻⸻⸻⸻⸻⸻⸻⸻⸻⸻⸻⸻,249494803811663873,,9/11 jokes,2020-09-11,
Aobtop,753559855855566888,,"Trolling, not taking roleban seriously, abusing quickdelete.",2020-09-12,
Floofy Floofer,746710028521701418,,Generally being a pain in the ass in roleban,2020-09-13,
Floofy Floofer,746710028521701418,,Spam in newhome,2020-09-13,
TheVoid,751915297287569420,,leaving/rejoining vc to spam notification sounds,2020-09-14,
strangrtimr,132214889463808000,,Trolling in chat,2020-09-14,
The Great Papyrus,752717530086375455,,Left server after posting art from google search,2020-09-14,
