Name,ID,number of warnings,Reason,Date (YYYY-MM-DD),Expiry - 60 / ∞ / ∅
HondaTatsuo,372113245001220098,,Suicide joke/reference in <#324642291044057099>,2018-02-17,
SudjiX (Julustan),265504980302036994,,Used a here ping in undernet,2018-02-18,
what is a username,340697439981797378,,KKK meme in <#324642291044057099>,2018-02-19,
Familyfriendlymanthatlikesfamily,250110310487293953,,Failing to read <#278763477831516161>,2018-02-19,
tikoblocks,338164957709336579,,big smelly frisk ascii spam,2018-02-19,
Douglas,311323874119647242,,Posted a phishing/scam link in newhome,2018-02-19,
spank me harder daddi.,413184284539748352,,Trolling,2018-02-20,
Darknight365,275757781112324096,,Roleplaying in newhome even when told to stop,2018-02-22,
Frisk’s Asriel,232240601817415682,,Continuing to quickdelete and attempting to bypass YBF's delete function,2018-02-24,
Alpha hippo pimp,317421496030986241,,Interrupting newhome with a barrage of memes,2018-02-25,
NotCappy,325428482958032896,,Contextless embeds in newhome,2018-02-25,
Sans,408956252882862090,,Advertising,2018-02-25,
Yall Are Weebs 2.0,221664770942566401,,Spam,2018-02-26,
DSteve101,410683016915189763,,Shilling,2018-02-26,
Football,382934585941557250,,Shilling,2018-02-28,
Ahmed14Gamal,355262299600191488,,Stupid rape joke in <#324642291044057099>,2018-03-02,
Golden,314002590876696577,,Shill in DMs,2018-03-03,
Storm,419931952926294036,,Weak baiting and bot abuse in newhome,2018-03-04,
Comic,420337740845154340,,Emote spam in newhome,2018-03-05,
blowjob for $21,304118384663068673,,Irrelevant embedposting,2018-03-06,
คt໐๓iktคŞ,187660609180008448,,Changed name to Wingdings garbage when told to change nick to something mentionable,2018-03-08,
Sans the Skeleton,362389275968274432,,Roleplaying in <#120330239996854274>,2018-03-09,
Sans the Skeleton,362389275968274432,,Attempting,2018-03-09,to
BeastlyAntics,301636575111151616,,here ping in newhome,2018-03-11,
Digibit,328158955870093323,,Everyone ping and shilling in newhome,2018-03-12,
Bloodwraith7,423187155842629634,,Sending unwarranted server invites to users in DM's,2018-03-14,
Effløresence,457647532617760781,,Announcing hes leaving in protest literally a minute after being told not to.,2018-03-14,
One lezbian Chara Smurf,405128602934312960,,Spam in <#194627177013182465>.,2018-03-14,
Uncle Al,318450622623907841,,tried,2018-03-15,everyone
hudsondaboss,370979269486051338,,Server shill in newhome,2018-03-15,
Erased Files Asriel,365194989434699786,,Continuing to lightly spam newhome with vapidposting,2018-03-15,
sans the bitch,403754495169003541,,Everyone ping,2018-03-16,
Inky Le Baka,342390662156779531,,Derailing newhome with a suicide meme,2018-03-16,
Ichigowolf445,420726726457557012,,Emote spam,2018-03-16,
HondaTatsuo,372113245001220098,,Derailed conversation with a shitty meme about fidget spinners and autism,2018-03-17,
CactusChips,408331191159226368,,"Spamming, DUI (Discord Under the Influence)",2018-03-18,
spagetthi never forgetti,389083397630459924,,Shilling,2018-03-19,
Headshotjudah,421121187758997519,,Knowingly shitposting after other people were told to not shitpost,2018-03-20,
pastelangel123,425746543610691595,,Continuing to post symbols in chat after being asked to stop,2018-03-20,
schplankeet,402413173292007435,,shilling,2018-03-20,
aine,346184244474937346,,Racial slurs,2018-03-21,https://suplex.me/LoudInsubstantialSawsbuck.png
aine,346184244474937346,,who want to join my undertale my little pony sex gang,2018-03-21,https://suplex.me/QuestionableFloralwhiteLarvitar.png
DronkWater,426085424310517764,,Shitposting repeatedly in <#120330239996854274> after being asked to stop.,2018-03-21,
Sans the Pun Master,360800058091765760,,Not moving shitposts to trashcan.,2018-03-22,
Pixel Artist,383769085256663040,,Emojispam,2018-03-23,
Azriuss,379337407255805954,,Shilling their youtube channel in multiple channels including support. YT link had a discord link in the description.,2018-03-23,
femaleblueberrysans,426902403003187201,,Friend request harassment,2018-03-24,
Vincent,259902808109744129,,Grody Roblox penis,2018-03-25,
dusttale sans,412394398513627137,,Roleplaying in <#120330239996854274> to a destructive amount,2018-03-25,
Ali *^* 4LiX,255432411280703491,,"Doxed a user who hacked their Facebook account, called on others to harass them",2018-03-25,
RedTheSkeleton,427338672917184522,,Used the N-word,2018-03-25,
lil'NightMare,322753833250062338,,Trying to mention everyone for 'destruction',2018-03-26,
thenotsoaverageman,427961160776548352,,Repeatedly derailing with immature outbursts during a conversation,2018-03-29,
snake,337041846159278090,,Server shill.,2018-03-29,
Mike Schmidt,429138733996965890,,Immediately proceeding to use a text converter for messages after being told to knock it off.,2018-03-30,
Gnawms,604369919949406238,,Aggressively pushing and participating in a heavy argument in newhome.,2018-03-31,
Ulises1Doggo,361665059967074307,,"Sans isn't ness, you MatPat love vat",2018-04-01,
FlyCidgeyGO,352485647874785282,,DMing multiple people their SoundCloud,2018-04-01,
Atlas,74768773940256768,,still being atlas,2018-04-01,
Chara,406787110486671360,,Server shill in newhome then quickdeleting it,2018-04-03,
Clove,186274377459826689,,Shooter jokes lierally minutes after it happened.,2018-04-03,
Clove,186274377459826689,,Continued arguing of making active shooter jokes following previous warning.,2018-04-03,
kazoodles,431217731099164685,,Posting pedophilic content in trashcan,2018-04-05,
sans,431979823007531018,,Shitposting in newhome after being told to stop,2018-04-07,
Lans,191358829479329793,,Rule 5 and 6 violation in newhome.,2018-04-08,
aquaduct,422048388649975818,,Huge wall of memes in <#324642291044057099>,2018-04-08,
theActualdeltadude,142428067518873600,,a here ping in trashcan,2018-04-08,
nasso,223874511567716353,,posted diaper fetish meme in trashcan,2018-04-09,
scrunt,289667685665603585,,Posting a racist meme in newhome,2018-04-10,
COMMANDER THORN,327515764091518976,,Shilling in newhome,2018-04-11,
twintwanjohn48,434497515396530177,,Server shill in trashcan,2018-04-13,
Mew,243151412282916865,,"Nsfw shitpost derails yet again, permanent for repeat warning.",2018-04-15,
Beelzebub,435477448835072017,,Continuing to disrupt newhome with cryptic garbage,2018-04-16,
DoubleThePsycho,272894125718896640,,"Derailing conversation, tried arguing what is and isnt an embed",2018-04-18,
NasodQueen345,415664681446014978,,"Spammed emotes, despite being told not to",2018-04-19,
TheWriter,207534915015671811,,Joked about Ross killing themselves,2018-04-20,
Vegeta (Abridged),127176232176582656,,Attempting to instigate a user in newhome,2018-04-20,
Ah_0,370595218887802881,,"Randomly posting the same (or similar) gaster image several times despite being told to stop, told a user 'duck you' when they asked them to stop",2018-04-24,https://suplex.me/WoozyDismalSwadloon
SoulofDemonz,367422961235263501,,Shilling in <#120330239996854274>,2018-04-27,
the meeping lucario98,417886848707198987,,Posting random emojis after being told to stop,2018-04-27,
Effløresence,457647532617760781,,Refusing to cooperate in <#253277974869049345>.,2018-04-27,
𝖀𝖓𝖉𝖊𝖗𝖙𝖆𝖑𝖊𝕺𝖇𝖘𝖊𝖘𝖘𝖎𝖔𝖓,429020300437487636,,It's 2018 and people STILL fall for 'if you don't repost this a ghost girl will kill you'?! Give me a damn break.,2018-04-28,
DOKI_YURI,425602093051543564,,Pasted one of those 'look out for this user' copypastas in Newhome with an everyone ping.,2018-04-28,
weeb ass,439989662291853343,,Racial slur on join,2018-04-29,
soulsans,257921153975320577,,Mentioning everyone for a comic idea,2018-04-30,
♡Aine♡,346184244474937346,,Spoiling infinity wars after being told not to,2018-05-01,
Mayoshi Madness,420619500908707841,,Shilling in support,2018-05-01,
Dope-Chan,294654126137147392,,Trying to spoon us. By spamming spoons,2018-05-02,
soulsans,257921153975320577,,"Derailing with own font, infinity war memes",2018-05-03,
DrakeStorm,441806505981771776,,Posting the lyrics to a song in its entirety without context.,2018-05-06,
Dragonbuns,199238486199369728,,Posted Mario's flaccid dong in trashcan,2018-05-07,
LelouBil,203874311696547851,,Server shill.,2018-05-07,
tntdragon21,419729101029638154,,Trying to ping everyone,2018-05-08,
Sans Slywian,443647957724561410,,Shilling,2018-05-09,
CrescentStorm,386759341232881665,,Using tags in newhome immediately after being told to stop,2018-05-10,
iRED,235593018332282884,,"Failure to follow moderator instructions to post random emotes, still posted an emote in retaliation in Jug",2018-05-13,
-Geeksoftheinterweb-,446032804288004098,,Said that it would be fun to shoot up their school,2018-05-16,
Wizard,167111259584462848,,Ignoring 'ded chat' shit,2018-05-16,
Adzelf,362453775891431437,,Being an asshole,2018-05-17,
spirit 69,440094824419295233,,spamming 'sorry' in every channel after getting rolebanned for spamming 'lol' in every channel,2018-05-17,
DrakeStorm,441806505981771776,,shill't,2018-05-17,
🥀🌹-selena the pretty devil -🥀🌹,435675573197471744,,Derail with a nsfw joke,2018-05-24,
Korza TheLord,232419839350669312,,Posting a meme in #trashcan with a racial slur.,2018-05-24,
Xunivers2138,438465172022231060,,spammed emotes after being told not to,2018-05-26,
TheFanficReader,439550732895649802,,dm'ed a staff member nsfw,2018-05-28,
VeniGamiz,158330542172012544,,Continuing to keep newhome derailed with a raiding party.,2018-05-28,
doug,100103787938594816,,Mentioning everyone becasue 'its funny lol',2018-06-04,
W.D. Gaster,336194864603725825,,Emote spam/Wingdings in trashcan after being told not to in mediaclub,2018-06-05,
[***尼羅快遞***],299397935647424514,,Shitposting outside of <#324642291044057099>,2018-06-16,
((X-TFTLC)) Monoko,326126445925498880,,Server shill with @ here,2018-06-17,
Realizations | logic,128994376692137985,,Jokes about herpes,2018-06-17,Joined with raid invite
Mushr00mkingdumb,455137974644899842,,everyone ping,2018-06-23,
derek,203652143327084544,,"Talked about Sans' heinous ghost whopper in chat, kept insisting he was Sans",2018-06-25,
ThatOneAlligator,382989386058563584,,Suicide jokes in newhome,2018-06-25,
ThatOneAlligator,382989386058563584,,shilling in newhome,2018-06-26,
wizard,167111259584462848,,distributing fake pirated copies of undertale without explaining that so it's like how were we supposed to not know he was distributing warez,2018-06-26,
Shadow Ink,454442944464945154,,shilling,2018-06-26,
Shameimaru Aya,368962889182085131,,"Rule lawyering, baitposting.",2018-06-28,
Specas24,287545785044697088,,"Role-begging, roleplaying in <#120330239996854274>, rape jokes, refusing to read <#278763477831516161>",2018-06-28,
***Killer_Sans***,425027322786349057,,Spamming emojis in <#324642291044057099>,2018-06-28,
<NSA>,458819911007993876,,everyone ping,2018-06-28,
Nøt Tøday,456530040218320906,,saying dead chat in <#120330239996854274>,2018-06-29,
Bob636369,288046371649486848,,everyone pinged thinking it was staffs job to entertain them,2018-07-02,
Weegee9991,279642715275264000,,Used an everyone ping trying to find people to play fortnite,2018-07-03,
Bob636369,288046371649486848,,posting memes outside of trashcan even when warned not to,2018-07-03,
Bob636369,288046371649486848,,posting memes outside of trashcan even when warned not to again,2018-07-03,
Mango,464074923472846858,,Pointless trolling about hollownight in newhome,2018-07-04,
Ugandan Sans,332833628721774592,,spam,2018-07-05,
TheGreatBobby,438845537668825098,,here ping,2018-07-06,
Nutted Mike Wazowski,364065213814669313,,Glorification of suicide,2018-07-06,
James3424,464584463465185322,,Posting a large chunk of flowerbed in newhome randomly,2018-07-06,
UnrecognizedTalent,412293980383084546,,continued emote spam after being told to stop,2018-07-08,
🤔🍆Daddy JJ🍆🤔,202937766491848704,,Picture of SpongeBob sucking Patrick's dicc in trashcan,2018-07-08,
nasso,223874511567716353,,cropped porn,2018-07-08,
Hapz_,199031342313242625,,Rolebanned for arguing in <#120331891185287171>. Warninged for continued arguing in <#454680849313693699>.,2018-07-10,
Hapz_,199031342313242625,,Rule 6 Violation: Argued about why the gaster role's requirements exist in the first place when he doesn't even understand it,2018-07-10,
shrek the ogre knight,301701394199478272,,continued posting memes in newhome after being told not to,2018-07-13,
Kepe,298556403402932234,,School shooting meme in trashcan,2018-07-14,
Undyne,436545887527763988,,Shill in newhome,2018-07-16,
Diamond_Operations,438139117080018965,,making a suicide meme and not even finding the right channel,2018-07-17,
PrupleLizrard23,300682463284297746,,Shitposting in <#194627177013182465>,2018-07-17,
Kome,311218951377911808,,"Posted a transphobic meme in trashcan, pardon my Tumblr",2018-07-19,
ya_boi,430639062479798272,,shill in newhome,2018-07-23,
MarshalGaming,273861145008406529,,shilling in newhome,2018-07-23,
arceus vega,468544038975307785,,DM shilling,2018-07-25,
morsesgamingØgo,374256142169407488,,suicidal stuff,2018-07-25,
Hollystar2004,472213694554570763,,Harassment; repeated friend requests,2018-07-27,
Prungoid,470783223786504192,,Shilling through newhome AND DMs,2018-07-27,
Ban Kulin,273861145008406529,,DM shilling,2018-07-27,
captaingoosehead,254346360654921728,,Shitposts outside trashcan,2018-07-29,
[***尼羅快遞***],299397935647424514,,Perry x Doofenshmirtz mpreg right after being told not to post NSFW/Fetish art,2018-07-29,
Flowey,461948330076012544,,"Posting memes in newhome again, even after being warned not to",2018-07-29,
SoulDragon969,224147200744095744,,also was posting memes in newhome,2018-07-29,
Flowey,461948330076012544,,"Shitpost outside of trashcan, again",2018-07-29,
Hydraphobic,461948330076012544,,DM shilling/harassment,2018-07-30,
KnightSmith,193424429630357504,,Shitposting everywhere but trashcan,2018-07-31,
justin,290258852698390529,,Shilled after being told he couldn't partner servers,2018-07-31,
memesnotdreams,440313032418131977,,"Naked Sonic in mediaclub, shitpost outside trashcan",2018-08-01,
Michael Hunt,433042287480799233,,Spamming the sans bad time emoji,2018-08-01,
Sans the skeleton,425027322786349057,,Derail with cropped porn,2018-08-01,
Hailwulf,410982464933330966,,Very nasty and aggressive behavior,2018-08-03,
Irradiated Death Lizard,439373786077331456,,Threatened to post gore in chat,2018-08-04,
iluvsans223,259113257191604225,,Spamming in the gaming chat and then threatening moderators in judgmenthall.,2018-08-04,
SpringTrap,474989972542193665,,shill in newhome,2018-08-04,
AntiVirusSans,475306411392237568,,Shilling,2018-08-04,
AntiVirusSans,475306411392237568,,Server shill.,2018-08-04,
Killer Chara,475475384368889857,,Trying to mention @ everyone,2018-08-05,
spazzxd,317388986983120896,,"Wall of text...err, wall of *no* text",2018-08-07,
Noble,293073086591533056,,Posting porn.,2018-08-10,
TheAveragePxtseryu,115459908215767041,,Responded to verbal warning with 'no u' after posting contextless embed,2018-08-12,
Zeyphr,167093492424769538,,Kept berating Gnawms despite several demands for her to stop,2018-08-12,
pinto like the bean,291348210654511104,,shitpost outside of trashcan,2018-08-22,
Западная Виргиния,436251626831872000,,Utter douchebaggery,2018-08-22,
Clove,186274377459826689,,Enticing people to raid and spam NSFW images. (Rule 1C violation.),2018-08-23,
rinktest505,482171375042297856,,Spamming a FNAF video in every room,2018-08-26,
Baldi,325428482958032896,,"Ban-begging in newhome, a long time ago",2018-08-28,
trizor,382287829121630218,,shilling in trashcan,2018-08-30,
OS! Sans/Empty/Hype,422293505356857345,,Insulting other users and using <#120331891185287171> as a general chat,2018-09-01,
Cradisorn,270924966625673226,,posting a giant ascii art in newhome,2018-09-01,
SansTheSkeleton,480696815486763018,,Repeatedly spamming referral links in every channel.,2018-09-02,
TheAveragePxtseryu,115459908215767041,,derailed by posting random embeds in newhome,2018-09-03,
Yall Are Weebs 2.0,221664770942566401,,Randomly mentioning people who's usernames start with A,2018-09-03,
hawkkaz,465508777550938122,,Spamming in trashcan,2018-09-04,
borger,344273597612818444,,Everyone ping in undercade,2018-09-05,
fr0sk,442712724296695810,,Queued up exceedingly vulgar song in <#168425600342556673> and then proceeded to parade it around the server like it was something to be lauded,2018-09-07,
Lukeisthenewluigi,476426064130736128,,Shilling a server,2018-09-07,
fr0sk,442712724296695810,,Disrupting conversations with random emojis.,2018-09-08,
fr0sk,442712724296695810,,School shooting meme in <#324642291044057099>,2018-09-08,
mlg360noskp,487311207959756810,,"Contextless images, argued with staff",2018-09-09,
MLG KING DICE,448297195570200577,,spamspacito,2018-09-10,
Yeeeeeeeeeet,461705731264217098,,Posting Nazi Memes,2018-09-11,
Meme-boi,310851584646971393,,"Using wingdings in chat, replying 'no' in wingdings when told not to, replying again with 'frick off' in jug",2018-09-12,
Solid Snake,224616554099113984,,purposefully trying to 'trigger' people with offensive memes,2018-09-15,
Furry_Boi,481269970635063316,,Shilled,2018-09-15,
Asriel,362376950989455362,,Spamming in <#120330239996854274> after several warnings,2018-09-16,
Sans,475233774943338506,,"Roleplaying in Newhome, spamming wingdings in newhome, and telling a mod to ""shut the fuck up"" in newhome",2018-09-16,
GageTheGamer,480454460523544596,,"Kept spamming emotes, then talked back at staff when asked to stop",2018-09-18,
UnderBrawler,478530686018650113,,shilling,2018-09-19,
>CrownHunter<,479584060906143766,,shilling,2018-09-19,
AmosThyFish,492022778103332864,,"gay slurs in trashcan, making people uncomfortable despite calls to stop",2018-09-19,
S̷̿̏a̷̛͒͐̉͝N̵̋i̶̛̇̀T̸͉͑̔͠y̸̍͗͋,263474039941496843,,"Suicide jokes in <#324642291044057099>, had to be told at least 3 times before",2018-09-21,repeat offender
SansTheSkeleton123,493227548990373899,,Posting shitposts outside of <#324642291044057099> and derailing <#120330239996854274>.,2018-09-23,
LHM12,214234714729480192,,here ping,2018-09-23,
TinkerStick,442429052754853909,,Attempted to ping everyone the moment they joined,2018-09-29,
ninjagamerleo,486613759482134529,,Trying to mention everyone,2018-10-01,
gigan私はそれを笑った,494151513300533278,,attempted everyone ping,2018-10-01,
Picturized,356573640680144896,,Posting borderline NSFW in newhome,2018-10-03,
Sans and Papyrus,281790599651131392,,Ignored rules due to being unable to see them,2018-10-05,
Madkittygaming,482370980073832470,,shitposting outside of trashcan after being told to move to trashcan,2018-10-07,
gamer,357672415150735360,,Trolling in newhome regarding incestuous/pedophilic ships,2018-10-07,
emerald,196651306578870272,,Repeat offense of 'No NSFW Avatars' rule,2018-10-08,
emerald,196651306578870272,,Same as above.,2018-10-08,
HeartBoundFan,454645419431952387,,Shilling in home,2018-10-11,
Average cat,500139884388941835,,Shitposting in newhome after having been asked to stop several times over.,2018-10-12,
Average cat,271416707732602880,,Shitposting in newhome after having been asked to stop several times over.,2018-10-12,
HyperAzzy,271416707732602880,,Randomly shitposting in newhome again,2018-10-14,perma ∞
GamerStyle,501838287179350043,,called the creator of smolbot a f-slur after it just stopped a raid,2018-10-18,
krave,331014778984202242,,random annoying shitposting in newhome,2018-10-21,
Pebble,241371259097579520,,random annoying ms obama shitposting in newhome,2018-10-21,
shugbear8bit,463152167373766688,,posting the same message in every channel they could,2018-10-24,
xander jackson,502204229512069121,,repeated shilling,2018-10-25,
Adair,419364597947170826,,trying to use @ everyone,2018-10-30,
Squid,508068825091014660,,"Inviting a user who started spamming, later got banned",2018-11-03,
chicanon,317519641343819776,,"called another user autistic, as an insult",2018-11-03,
MisterPotato,234112786555207680,,deltatrash spam,2018-11-03,
Epic Sans Gamer Man 100,295755439537258497,,nsfw in trashcan,2018-11-04,
Sneeky Snek#3657,500798849011679233,,Spamming an image in multiple channels multiple times.,2018-11-04,
DaddySans#1337,168254301230071808,,Spamming emojis in <#194627177013182465>,2018-11-05,
Nleoln,507310229130706945,,period spam,2018-11-07,
Klein Holland#5068,463779069176315915,,unsolicited DMs,2018-11-07,was asking to send Tori nudes
InfiniDIE,509790096145514506,,"Repeated derailing in Newhome, Non-cooperative with staff.",2018-11-08,
JT,371366145426718722,,keeping on posting a communist anthem playlist in the deltarune/ut channel after being told not to,2018-11-11,
SlappyTheDummy,509387121455529986,,shilling in dms,2018-11-13,
dogitis#7664,491736144577560576,,Repeated,2018-11-16,spam
undєrtαlєх,489370880879624203,,emote spam,2018-11-17,
Dqwk11#3299,345433262304264195,,Posting memes in <#120330239996854274> after being instructed not to by a moderator.,2018-11-17,
Meme-Chan#1940,353656370127568897,,Literal image spam for the umpteenth time.,2018-11-19,
Capt#4328,224217906643206145,,Attempting to find weaknesses in Flowey's message deletion capabilities.,2018-11-19,
achoo,271348115171180554,,everyone ping,2018-11-19,
Dipper_YT#2785,501808499592790046,,"Emoji spam, uncooperative with moderators",2018-11-19,
GuNMouTH#1711,161348502570532865,,Everyone ping in newhome.,2018-11-19,
mireactive the mierlark#0398,414256779111694346,,Persistent spam and derailment in Newhome,2018-11-21,
zaphodsheads#4839,199935397143248898,,Lancer Chatbox spam in newhome after being asked to stop by Orangestar,2018-11-23,
CrunchyCroissant,499690110774935583,,"game theory video spam, screaming in all caps",2018-11-24,
PhotoNegative Nassar,506346398099308556,,"Emote spam, told staff to die when told to stop",2018-11-25,
Erik 🐢,428699023113715712,,racial slur,2018-11-25,
Erik 🐢,428699023113715712,,Constant stream of vapid nonsense immediately after previous roleban,2018-11-25,
Felix. L,299338133231763467,,"toxicity, pedophilic remarks",2018-11-26,
Aonator,337650389254144021,,posting a very descriptive paragraph about fucking dogs or something,2018-11-26,
Erik 🐢,428699023113715712,,Constant shitposting in <#120330239996854274>,2018-11-28,
SuperRobbie,255035269407834118,,Continuing a conversation in # mediaclub after being told to stop,2018-11-29,
Khagan_Massin,465600323935797289,,Text art in trashcan,2018-12-01,
rentata,276847629814726658,,shilling,2018-12-01,
FestiveGuitar,177013899177099264,,everyone ping,2018-12-01,
PhotoNegative Nassar,506346398099308556,,Emoji spam and weakly-related remarks to the point of derail. Has been warned multiple times.,2018-12-01,
T-SquaredProductions,223180533067284481,,Repeatedly posting the same thing after being told to stop by multiple moderators.,2018-12-02,
RareBeeph,318505902468628480,,Botspam in trashcan,2018-12-02,
Chris Likes Carnage,513466127817637889,,Jumped into chat talking about Sans' sexual escapades,2018-12-03,
DustSansGaming,503892831203491840,,Spamming the Lancer head emote,2018-12-03,
whatspoppin,419090393565495298,,copypasta telling us to subscribe to a youtuber who isnt relevant anymore,2018-12-04,
ShugBear_HollyJolly,463152167373766688,,spam-pinging someone,2018-12-04,
schlorb,471327251393150986,,micspam,2018-12-05,
【スペース】,313829944985649154,,micspam,2018-12-05,
Temmie,402659707560525825,,Posted images and comments proving they had pirated Undertale.,2018-12-05,
aeiouy,517482006301638676,,NSFW text post in newhome,2018-12-05,
Scarce,484428239738241027,,Continued posting emotes after being told to stop,2018-12-05,
NoSkillMan,437534417804853248,,continued posting emotes after being told to stop,2018-12-05,
Merry Kris-mas,345706196977844227,,Everyone ping,2018-12-06,
A Fancy Duck,249767055648227329,,"Incessant trolling, even when told to stop",2018-12-09,
Rafc,486928741965103104,,german spam,2018-12-09,
MechanicPluto24,320974635925504000,,"Taking out his anger on other members, telling one to fuck themselves",2018-12-09,
mettaton,428551580334424064,,"Spam in newhome, refused to comply with moderator requests in jug",2018-12-10,
Pignite772,249601177887571968,,sans gaming spam,2018-12-11,
swordpepi,364113327087026179,,Derailment with emotes,2018-12-14,
freddyash10,490197694443159572,,DM shill,2018-12-14,
AsrielNyx [Garrus Gang],506716922776387594,,"attempting to derail, fought back aggressively when told to stop",2018-12-15,
Way~,299391306298425355,,Extreme venting/expressed desire to kill self,2018-12-16,
MasterDwarf117,408769806699855876,,"Posted memes in <#506854523818475531> , did not read rules",2018-12-16,
MetellaStella,329383982942650370,,"belligerent in jug, posted memes in <#506854523818475531> ",2018-12-16,
Way~,299391306298425355,,Repeatedly changing nickname to be difficult/impossible to mention despite moderator intervention several times.,2018-12-16,
kennedy,318655321029738506,,Racism and trolling.,2018-12-16,
kennedy,318655321029738506,,Posted literal shit,2018-12-16,
dusttale sans,488586441962815500,,"posted artwork multiple times without providing source when told not to, arguing about rules being too strict",2018-12-16,
ElectroElectra,445939340292522004,,"`ded chat`, trying to roleplay/be vapid in newhome",2018-12-17,
ElectroElectra,445939340292522004,,"Further vapidposting, zero behavior change after release last time.",2018-12-17,
Tigeski,199385384944140288,,Derailling after a specific warning against derailling by a moderator,2018-12-18,
MubbZ14,476854539958353940,,Baitposting,2018-12-19,
ukuleleninja,221678693922242560,,Noncooperative in jug after being put there for rule 5 problems.,2018-12-20,
RelaxedTuba27,466023427787194388,,"pinging for ever message to someone, pinged again when told to stop",2018-12-21,
Zap,300923168481083392,,Venting in newhome and refusing to comply with moderator requests to stop. Tone policing.,2018-12-22,
King1806,438528155825733633,,Shilling,2018-12-25,
