Name,ID,number of warnings,Reason,Date (YYYY-MM-DD),Expiry - 60 / ∞ / ∅
Gnawms,604369919949406238,,Posting NSFW Content in #newhome.,2017-05-15,
Cashspticeye,266729524366934017,,Continuing to ask 'join hotel room' after being asked to stop,2017-05-14,
Aza,168362841022136321,,Continued spamming Koala pics in #newhome after being asked to stop.,2017-05-14,
T3R3Z1 PYROP3,192089454305869824,,Using Quirks,2017-05-14,
DR4GON LOV3,192089454305869824,,Quirking yet a-fucking-gain.,2017-05-14,
Icewolf,146545496192843776,,Sent an inflammatory message to Madzci which sparked drama among users,2017-05-13,
Moony,282784540215345153,,"Contextless posting in #newhome, did not respond in #judgmenthall",2017-05-13,
doot-is-unbootable,134166550549757952,,"Breaking the ""fetishising bans"" rule after another user was scolded for it. Further insolence in #judgmenthall lead to this warning.",2017-05-12,
Grayson (Xorn),143891265283555328,,First unban.,2017-05-12,∞
Pec Mons,267461306188169227,,First unban.,2017-05-12,∞
Necromancer,299286332314877953,,"Random server shill, was foreboden before and said they've read rules",2017-05-10,
Im a dog,228294068159905792,,"Posting the same image like 5 times in a row, not responding in #jug",2017-05-09,
Necromancer,299286332314877953,,Consistent shitposting after being told multiple times to stop.,2017-05-09,
Necromancer,299286332314877953,,Random embed and unrecognized HTML file,2017-05-08,
Computrix,189537671289241602,,Incessant minimodding.,2017-05-04,
Inkx,122043518544904192,,Constantly shilling himself for a staff position.,2017-05-03,
origami,232535536340828160,,Posting NSFW imagery in #newhome.,2017-05-01,
origami,232535536340828160,,"Posting random, contextless embeds.",2017-05-01,
Darkshreaders,296440120192532492,,Shilling in morse (after being told they can't shill),2017-04-26,http://i.imgur.com/E9uswCp.png
KirbySmasher48_YT,268941936554016768,,Posting copypasta on join.,2017-04-23,
Rayhaanlol,283151684757356544,,Being toxic and insulting another user over nothing.,2017-04-21,
Omnitrix,179182645014560768,,Refusing to stop RPing in #newhome after being told to stop by a moderator.,2017-04-18,
Omnitrix,179182645014560768,,Being unneccesarily difficult in #judgmenthall.,2017-04-18,
MugLife,299291226790690817,,Posting trypophobia triggers in newhome,2017-04-18,
Korama,295702382346764289,,Posting borderline NSFW pictures after being told to stop doing so.,2017-04-17,
Sonic/Riolu,222868188831023104,,Random embeds/puns despite being told to stop several times,2017-04-17,
Sans the Dank Skeleton,269669428235468801,,Server shilling,2017-04-14,
The Cringe King,222399224891834379,,Continued to meme after being told to stop,2017-04-12,
DarkyChan,196698980837490688,,Server shilling in DMs on join.,2017-04-09,
DarkyChan,196698980837490688,,Server shilled in DMs *again*.,2017-04-09,
Potrock,247965561470976004,,Derailing #newhome with contextless memery,2017-04-08,
Angelic,131525678515355648,,Threatening to spam NSFW with an alt and then playing it off like it was no big deal in #judgmenthall,2017-04-08,
M~SWATPUMPKIN,137976875417862144,,Server shilling in DMs.,2017-04-07,
Hand Man,188813873908809730,,"Posted a man taking a shit with pampers, not responding in judgementhall",2017-04-05,
atlas,74768773940256768,,being atlas,2017-04-01,try and see if b1zny can delete his account too
SCOOT,161078012161294336,,posted alodda dolphins in newham,2017-04-01,
El_Isma,293858750207361026,,Server shill,2017-03-29,
Asriel Dreemurr,246386692355915776,,"Using a bot command directly after the entire chat was warned to not use bot commands, on pain of a warning.",2017-03-28,
Flareblood,195546413105545216,,"being a general twat, posting extreme edge when asked to stop, defiance of moderators, flat out insulting europeans",2017-03-25,
gaylol,233397992957149195,,Obviously didn't read the rules and stepped into #newhome asking about NSFW content.,2017-03-23,
alice.the wrong alice,294120446150967296,,"Server shilling, didn't respond when foreboden",2017-03-23,
Pride in Prejudice,200060712477917187,,Tried to derail #newhome multiple times and proceeded to rules lawyer in #judgmenthall afterwards.,2017-03-20,
HEYMAN,231489813105082368,,Posting inappropriate content,2017-03-19,
The Cringe King,222399224891834379,,"Okay, don't call people names, especially autistic.",2017-03-19,
HEYMAN,231489813105082368,,"Posting innapropriate, off topic imagery in #home",2017-03-19,
Jackson,150407936554827776,,Contextless minor spam in new home,2017-03-18,
manolo,239136072318058506,,Random memes in newhome,2017-03-14,
starcogirl39,291185943791271937,,"Refusing to stop talking about a recently banned user, even after being given multiple chances to stop.",2017-03-14,
Emeraldsparx,231470355477299200,,Permanent warning due to ban appeal.,2017-03-14,∞
connor,140684202810146816,,Posting a questionable looking rock formation in newhome,2017-03-12,
death grips,257955519690571776,,Racially insensitive language in newhome,2017-03-12,
Ayy Axcelly Kun,259088812477644801,,Posting contextless messages in newhome after bring told to stop,2017-03-12,
Practoid,222520276615692290,,Trying to start shit in newhome and posting an innappropriate chat message,2017-03-12,
temmie,281976540785410050,,Nsfw sounds in vc,2017-03-12,
Blueberry Sans!,272934932572012544,,Server-shilling,2017-03-11,Was kicked for inactivity
Literal Garbage,192089454305869824,,Suspected of alting,2017-03-11,Alt was kicked
ThatAsianShipper,231921965407928320,,posted image of a knife to his neck in #newhome ,2017-03-11,
Just Gary,221353586477498369,,Accidentally posted a porn link in newhome,2017-03-10,
Vector,268069198436106243,,Spammed in various channels and proceeded to harass another user,2017-03-10,
Vector,268069198436106243,,Being toxic to other users RIGHT AFTER being released,2017-03-10,
Slim Shady,226836239402270721,,Being rude to Japanese-native user,2017-03-10,
TuToriel,257436936816427010,,"Posting of random embeds, defiance of mods.",2017-03-10,
TuToriel,257436936816427010,,Prolonged defiance of mods.,2017-03-10,
TemFlakels,288843697460740097,,classic case of context less meming in newhome,2017-03-10,
ThatAsianShipper,231921965407928320,,Submitting a racist character application to the RP.,2017-03-09,
Corrupt3D,253013995856986115,,Posting a huge lenny in #newhome for no reason,2017-03-09,
Blueberry Sans!,272934932572012544,,Using #newhome as a VC text chat.,2017-03-09,
Gollum,257436936816427010,,Spamming emoji in #newhome,2017-03-09,
Flareblood,195546413105545216,,Consistent use of a tag after being told to stop by moderators.,2017-03-09,
Flareblood,195546413105545216,,Constant venting and ranting in clear violation of rules 1 and 2.,2017-03-09,
death grips,257955519690571776,,"posting vapid, near offensive imagery out of context in #newhome",2017-03-08,
bob,201435606511779840,,Created a tag of an antisemetic caricature.,2017-03-07,
Blobbo,193789388034015232,,Continuing a NSFW discussion after being warned against doing so.,2017-03-05,warning invalidated/old system
ToTheMax,224433000211808256,,Irrelevant shitposting in #newhome.,2017-03-05,
HEYMAN,231489813105082368,,Defiance of moderators.,2017-03-05,
MemesAreGreat123,279364691665354753,,Spamming after being told to stop by both users and a moderator.,2017-02-28,
@𝅳𝅳𝅳𝅳𝅳𝅳𝅳𝅳𝅳#7154,192089454305869824,,"being a general troll, refusing to stop after being told to by mods, using that capslock cruise control",2017-02-28,
isy,138690842696089601,,Violated the privacy of another user by posting screenshots of their DMs in #newhome without permission and for no good reason.,2017-02-27,
ImPuffet.exe,269222967492214784,,Server shill,2017-02-25,
Alabama windchime,283649422737276928,,Toxicity in #newhome.,2017-02-21,
Alabama windchime,283649422737276928,,Continuing to be toxic as well as arguing with staff in #judgmenthall.,2017-02-21,
ColinAV,199586932269776906,,Shitposting in newhome,2017-02-18,
Centurion,238357393728077825,,trying to ping everyone and here twice,2017-02-18,
taciturasa,97788939196182528,,Alting and riling up #newhome,2017-02-17,
Just Gary,221353586477498369,,Posting questionable photography in #newhome,2017-02-17,
Napstaluke,150341930453041154,,Posting a risque image that another user got rolebanned and warned for not a few minutes prior.,2017-02-17,
Megaquake2012,265706414671003649,,Continuing to talk about religion despite being told not to by a few users and staff,2017-02-17,
Ramza,104637294169849856,,"Constantly using NSFW/borderline avatars even after being told to stop doing so, *multiple times.*",2017-02-16,
CreeperCart,243087476057571328,,Posting the same papyrus image 4 times,2017-02-16,
Frisk15383,163086552195530753,,Server shilling,2017-02-13,
InkxTheSquid,122043518544904192,,"Raid riling in #newhome twice after being warned about it, and especially after the entire channel was chided for it.",2017-02-13,
cuteinkysans,250003322096975872,,repeated posting of unrelated embeds,2017-02-13,
a fascist,196934743667900418,,really stupid holocaust jokes and being a general dumbass,2017-02-13,
🕈︎.👎︎. ☝︎✌︎💧︎❄︎☜︎☼︎,235180256703676426,,Continuing to talk about testicles after being told not to,2017-02-12,
TheJoyfulOne,145324966999621633,,Spam in #newhome.,2017-02-11,
TheJoyfulOne,145324966999621633,,Rules lawyering after being Forebodened.,2017-02-11,
Micropachycephalosaurus,247965561470976004,,Server shilling a second time after being told not to,2017-02-11,
USSR BOT,238083758454996993,,Threatening to release dox records upon user join.,2017-02-10,
Pingus dad,247965561470976004,,Continued to shitpost after being told multiple times to stop.,2017-02-10,
SpookyDove,201547911480213504,,Trying to ping everyone then trying to delete the message to cover it up.,2017-02-08,
errorsans,277470012871147520,,"Posting a link to a site taken by domain squatters twice (asking people to check it out for free movies), shilled their channel and did not respond in judgmenthall",2017-02-08,
earthhisflathacked,273956020320206848,,attacking an user,2017-02-07,
Satan,184103135881461760,,Joining and using offensive language in #newhome.,2017-02-06,
crusadercat,265927549920608257,,Refused to stop roleplaying in #newhome after being told to stop by a moderator.,2017-02-05,
crusadercat,265927549920608257,,Continued to argue previous warning with said moderator.,2017-02-05,"Third warning, user was banned."
sans,183105577562537984,,Server shill.,2017-02-04,
Crusadercat,265927549920608257,,DM Harassment,2017-02-04,
「Coda」,266453646923923459,,"Distrupting chat, derailing and been told multiple times to stop",2017-02-03,
asen,81159419722735616,,Extremely rude towards GMs in regards to being banned from roleplay.,2017-02-02,
「Coda」,266453646923923459,,Random embeds in newhome after being foreboden and told not to,2017-02-02,
Blue Wiiu,273248137727049728,,Posted gore of Felix the Cat multiple times in #newhome evenn after being told to stop.,2017-01-30,
Blue Wiiu,273248137727049728,,Distrupting chat multiples times and told multiple times not to,2017-01-30,
asen,81159419722735616,,"Ranting in newhome even after being asked to stop, threatened another user and asked if they wanted to take it to DMs",2017-01-29,User was banned
The Giraffe Banana,261949481799516170,,Randomly DMing a user with harrasment.,2017-01-25,
Bonnie the Bunny,249027101162864641,,Random spam in #truelab,2017-01-25,
League Of Legends Fan,269013674155311104,,Randomly DMing people invites to a server.,2017-01-24,
Abdullahcraft,258916646025035777,,Server shilling in #newhome,2017-01-22,
.|| Core Frisk ||.,270277419850530817,,"server shill, not responding in #judgmenthall",2017-01-21,
asen,81159419722735616,,Going on about Tarzan beastiality in #newhome after being told to stop.,2017-01-20,
Silverstripe,229801242937917460,,Server shilling,2017-01-19,
robloxnoobkiler64,265283763498385418,,Mocked another user in #newhome while being disruptive at the same time.,2017-01-17,Refused to acknowledge the error for a while in #judgmenthall.
milk rice,265157291123277825,,Server shilling in DMs. Kiced for inactivity.,2017-01-15,
HypnotixHyphen,241611459136585730,,Using ateveryone in newhome for a shilled game.,2017-01-14,Did not respond in #judgmenthall.
roroollie123,250024488802975745,,Server shilled,2017-01-14,
blueberry_sansette,269262210222522378,,"Random embeds in newhome, even after being told not to",2017-01-14,
jcvc2000,233606249877340161,,contextless shitposting in newhome even after told not to twice,2017-01-12,
W.D Gaster,235180256703676426,,"Refusing to stop talking about nooses after being told not to, saying its to catch horses",2017-01-12,"Refusing to stop talking about nooses after being told not to,  saying its to catch horses"
W.D Gaster,235180256703676426,,Fighting with another user in #newhome.,2017-01-12,
UndertaleTrash420,259035467331272706,,Fighting with another user in #newhome.,2017-01-12,
Megaquake2012,265706414671003649,,"Talking about religion aggressively despite being told not to (and continuing even after told to stop by staff), going after another user even after being foreboden",2017-01-11,
The_Stargazer,217586226146967552,,Posted massive encoded text strings in #newhome,2017-01-11,
Daniel7689,206027130314686464,,"spamming a youtube link on join, which leads to scamming",2017-01-11,
sinn.sansy,265385034892967939,,spamming a short wall of Ms in newhome,2017-01-10,
bsamdafj,268101403833008128,,spamming ha (as well emojis) and been told to stop severeal times by users and trial mods and mods,2017-01-10,
thunderskyler{lvl18},266315722706255872,,Random memes in newhome,2017-01-10,
NotRemainings,265271097912590337,,NSFW commentary in #newhome,2017-01-09,
Steelchill,217377357919420419,,server shilling shortly after joining,2017-01-08,
CRAWLING IN MY SINS,266934792136687617,,randomly disrupting thew chat with nonsense,2017-01-07,
Hiki,257669355263885313,,Heiling Hitler then acting tough in DMs after being rolebanned for it.,2017-01-06,Kicked for not responding in #judgmenthall after 5 minutes.
genocide,266087093598420992,,Posting NSFW content in #newhome,2017-01-04,
Tαηιѕ,253269784618205184,,Posting Nsfw Soundcloud in #newhome,2017-01-04,
Lukaa,260069518355857410,,Being a conversation-disrupting nuisance in #newhome.,2017-01-02,
Lukaa,260069518355857410,,"Continuing to be toxic in #newhome against multiple users, did not listen when told to stop on previous warning.",2017-01-02,User is banned now.
azza,215427585977483264,,Racial slur in newhome,2017-01-01,
Nate,97002999657795584,,Micspam.,2016-12-31,
Nate,97002999657795584,,Micspammed again.,2016-12-31,
Nate,97002999657795584,,Micspammed for the third time.,2016-12-31,Three warnings. Bye bye.
MoistNipples,263992170065821696,,Refusing to drop the topic of pornography even though it was obviously making other users uncomfortable.,2016-12-30,
MattThePatt,209093109450145792,,"Massive ASCII art in #newhome, then attempted to hide it by telling users to not scroll up",2016-12-30,
P!ain Palkia(UTML),215481013034418176,,"Constantly shilling his ""sans troop"" in unrelated channels.",2016-12-29,"
"
P!ain Palkia(UTML),215481013034418176,,"Droning on and on in #judgmenthall, arguing with mods constantly, generally being annoying.",2016-12-29,
S4lty.boi.v1,142828024885280768,,Posting a link to an NSFW nosleep story in #newhome.,2016-12-29,
SpeedRunningDen Co-Owner,263859618705440768,,Spam on join.,2016-12-29,
Bacon That Expires in 2017,232352527448932359,,Server shilling,2016-12-29,
TrueLegend,257289496993857537,,Continuing an argument after administrative intervention.,2016-12-29,
ChristmasPenguin (Forthelolz999),111616497641660416,,Kicked for being uncooperative in #judgmenthall,2016-12-29,
HarryM,126110044625305600,,Server shilling.,2016-12-28,
GlitzerBlitzer,181502260449247232,,Screamer link spam for a youtube video.,2016-12-28,
Lukaa,260069518355857410,,Going on about how he punches people upon joining.,2016-12-28,
Yellow Oruks,234277901770555392,,spamming embeds ,2016-12-28,
Zuen,244913402667991052,,Random embeds in #newhome,2016-12-28,Posted furries and hitler
Zuen,244913402667991052,,Rule lawyering,2016-12-28,
Faygo,204377881315508224,,Posting a nsfw video in #mediaclub.,2016-12-27,
doot-is-unbootable,134166550549757952,,Permanent warning following an unban.,2016-12-27,∞
Kirimash,142706650246152192,,Permanent warning following an unban.,2016-12-27,∞
requex,261915267498508309,,Micspam in hotel lobby.,2016-12-26,
Kiyoshi,193488722749030409,,Contextless meme in #mediaclub.,2016-12-26,
Meeon,160809056322322432,,Server shilling.,2016-12-26,
ok.,250224494080163842,,being mildly disruptive in #newhome ,2016-12-25,has been asked to stop several times
isy,138690842696089601,,Permanent warning due to unban.,2016-12-25,∞
Matt,209093109450145792,,Permanent warning due to unban.,2016-12-24,∞
Matt,209093109450145792,,"everyone mention in #newhome, ten tried to delete it.",2016-12-23,user is banned
I_LOVE_TORIEL,261774295527587840,,Derailing conversations with contextless imagery in #newhome. 1b violation,2016-12-23,
Kitcat_vambremagiswords5908,261949481799516170,,Continuing to seek self-pity after being told by multiple moderators to stop and continuing with it in judgmenthall.,2016-12-23,
@Elite,251208363189338112,,"all caps spam in newhome, toxic language to users",2016-12-21,
Blobbo,193789388034015232,,Riling up #newhome with topics illregarded after staff intervention.,2016-12-20,warning invalidated/old system
secretlymrsaturn,154754188247564288,,"Couldn't figure out what common sense was (1a), was toxic against others(1d) and then started to ask repeatively what common sense and toxic meant, although it's cleary in the rules (6)",2016-12-18,
secretlymrsaturn,154754188247564288,,Double warning,2016-12-18,
doggoMayo,257668552960638976,,Posting irrelevant embeds in #newhome ,2016-12-18,
Dₑₜₑᵣgₑₙₜ (Flowey),259374666164994049,,Server shilling in home.,2016-12-17,
isy,138690842696089601,,Insulting other members of the chat and posting suggestive imagery,2016-12-17,user is banned
Stivmas likes to flip tables,130740715180261376,,"Kept meming in #newhome , despite being told to stop",2016-12-17,
DogeMayo,257668552960638976,,"Derailing newhome several times, using bots outside #truelab, Rule Lawyering and being generally stubborn in #judgmenthall",2016-12-17,
DogeMayo,257668552960638976,,"Continuing to meme directly after being released from #judgmenthall, further Rule Lawyering",2016-12-17,
sam,250039556567465984,,Disrupting voice chat,2016-12-17,
killr,259530257302945792,,disrupting voice chat,2016-12-17,
sam,250039556567465984,,"defiance of mods, we told him to stop at his first warning and he went at it again",2016-12-17,
UndertaleTrash420,259035467331272706,,Posting irrelevant images in newhome.,2016-12-16,
Katiebug586,157238090593861632,,Harassment in DMs.,2016-12-16,
Doktor_Luke,194181911231463424,,permanent warning from a sucessfull appeal,2016-12-16,∞
Radio,150237761322876928,,threatened to blackmail a user who was lying,2016-12-16,
Yato,259348661878652928,,Stealing art and telling people it was their own art in #mediaclub.,2016-12-16,
Undertalethrash420,259035467331272706,,Defiance of mods,2016-12-16,
Christmas Bob Ross,248465548126584833,,Server shill,2016-12-16,
Annuit Coeptis,253055896580653056,,Singing that shrek song after many attempts from staff and users to stop: kicked from inactivity,2016-12-16,
VeniGamiz,158330542172012544,,Permanent warning for appeal,2016-12-15,∞
HyperSonicX1,154002957648658432,,Spamming custom emotes in newhome.,2016-12-15,
Madzci,102298195505188864,,"abused/circumvented delete tracker, offensive to mods, rule lawyering, toxic to other users.",2016-12-14,user is banned
hoppsxnickshipfurryxd,239430072686084097,,offensive avatar,2016-12-14,
⎠⎞⎛⎝【ĞĤŦ】[ØאĐ]אＮØ.ƗØǤÃϻ€Ş⎠⎞⎛⎝,238962211404382209,,"Defiance of mods, didn't want to change nickname at first",2016-12-14,
epicdinoman,163322218670063616,,trying to derail with touchy subjects,2016-12-13,
Abyss,238348590727168000,,Server Shilling in DM,2016-12-13,"victim' was Girlycreeper, if that'll come in handy later"
The_Stargazer,217586226146967552,,"Stirring up chats since they joined, rule lawyering in #musicbox",2016-12-13,
The_Stargazer,217586226146967552,,"Making badly timed jokes in #judgmenthall, further rule lawyering",2016-12-13,
isy,138690842696089601,,Impersonatinng rice and getting her to leave,2016-12-13,
isy,138690842696089601,,Insulting another user and not stopping until mod intervention,2016-12-13,
Vixtron,99808569574031360,,Being rude to a mod,2016-12-12,http://i.imgur.com/pxDlAYs.png
P1k@chu,162392307021250560,,Bot abuse,2016-12-10,
P1k@chu,162392307021250560,,Rude to mods in #judmenthall,2016-12-10,
P1k@chu,162392307021250560,,Even more mod disrespect,2016-12-10,Banned for third warning
calciumAddict,192352940382617600,,Didn't read flowerbed,2016-12-10,
VGMaster Oshea,200020471511515136,,sending a user creepy PMs,2016-12-10,
Abyss,238348590727168000,,"Being a minimod, despite being told not to",2016-12-09,"He's 16 years old and somehow really bad in english, kek"
crispy,250023236937580547,," Spamming a link embed in newhome; kicked from inactivity
",2016-12-09,"kicked from inactivity
"
Droxy,132542015895240704,,Permanent warning due to unban.,2016-12-07,∞
TheRexxar,232956318196039700,,Posted lewd stuff in #newhome due to miscommunication of rules,2016-12-06,
MattPatt,209093109450145792,,Defiance of Mods + Disturbing #newhome,2016-12-06,
PankakesOfChistmas,255373056568983555,,Rule 2 Violation: Server shilling in newhome,2016-12-06,
smug alps,255183345464508417,,"not listening to mods, general attitude",2016-12-05,
♥Asriel♥,191051689208315904,,Roleplaying and spam in newhome,2016-12-05,
InxTheSquid,122043518544904192,,Disturbing chat in #newhome,2016-12-05,His age is confirmed to be 18+
Creator of Soul,217297897207758848,,"came on, failed to server shill, dm'd people, and when brought into #judgmenthall, did a weird roleplay",2016-12-03,I don't even
jacks property,123849409904640000,,didn't read the rules and violated rule 1c and 6.,2016-12-01,maybe we want to log him a double warning?
jacks property,123849409904640000,,double ranga,2016-12-01,"user left the server, we thought he was still foreboden and banned
"
mattpatt,209093109450145792,,spamming capital messages in #newhome after admin intervention,2016-11-30,
schleckenmiester,237724699935637504,,kept memeing in newhome despite being told to stop,2016-11-30,"nothing to add here, he didn't read it i guess"
radiobot,150237761322876928,,shitposting in #support,2016-11-28,
christmax,137701482983063552,,enticing people to freak out about raids.,2016-11-27,
paper toad,229468880215474178,,micspam in hotel room 2,2016-11-25,
-nobody,152598855580385280,,"nsfw content in a hotel room, normaly wouldn't let this go but i'll allow once this exception",2016-11-24,
arora,227237806538227722,,server shilling in #newhome,2016-11-24,Didn't read the rules after 2 months -_-
hoppsxnickshippedxdee,239430072686084097,,"obviously hasn't read the rules, being memeish in newhome, asking for.nsfw as underage",2016-11-24,
toko13,148313445354307584,,disrupting <#120330239996854274> with purposefully intrusive shipping commentary.,2016-11-22,
u,132319000179769344,,"Posting jumpscares, left while foreboden",2016-11-22,User is banned
waluigi,159701274433028096,,ban appealed ('brother got into my account') | permanent,2016-11-22,∞
sans the skeleton,234377524463927296,,posted updog after being told not to,2016-11-22,
madzci,102298195505188864,,went at a user and refused to drop said subject when asked to,2016-11-22,
kalozam,194181784919867392,,"repetitive memeing in newhome, third warning.",2016-11-21,User is banned.
rice,208633263303032834,,permanant warning for ban appeal,2016-11-21,∞
kalozam,194181784919867392,,Continuous meme posting in newhome,2016-11-20,User is banned.
sneezed,201174461104390145,,"posting unrelated memes in newhome, being agressive to staff",2016-11-18,user left while foreboden
kalozam,194181784919867392,,posting memes in newhome after purge,2016-11-18,User is banned.
crispy dong,230814873125126144,,posting a meme in newhome after a purge and a forebode for also posting a meme,2016-11-18,"
"
plutus,158673197921861633,,use of everyone mention for no good reason.,2016-11-17,oh he got banned right afterwards lol what made him possibly think that's a good idea
InxtTheSquid,122043518544904192,,spamming non-bot content in <#120331959703568386>.,2016-11-17,
xTech,226409823695011840,,"being toxic to all users, including mods (eg.""go die"")",2016-11-17,
dark nate,176087030214819842,,Derailing newhome with inappropriate content,2016-11-15,banne
Nyura,229071340202622976,,Appealed (perma),2016-11-14,Permanent warning; no expiry ∞
dark nate,176087030214819842,,"spamming unrelated images in newhome - same images as yestderday, which we didn't log.
",2016-11-14,banne
TheFlaberGASTERedGamer,243422016286228481,,Harrassing other users in DMs,2016-11-14,
SomaticMizuSan,119255861389557766,,Posting a screenshot of Undertale gameplay on PornHub...said screenshot happened to contain an advertisement for free blowjobs... ._.,2016-11-13,
Jimmy,202369432130027520,,"DMed hateful, terrible insults instantlly after a guy got banned for doing so with the exact same text.",2016-11-13,
Yoobii,146765572586209280,,Impersonatinng rice and getting her to leave,2016-11-13,
GenoSans,173377300690108416,,Spamming users with line breaks,2016-11-12,
GenoSans,173377300690108416,,"Spamming in #newhome, defiance of mods when asked to stop",2016-11-11,
Sans Pun Master,241901626477117440,,"Posting unrelated images in #newhome and other channels, bot abuse, admitting to not reading #flowerbed",2016-11-11,User Is Banned
