Name,ID,number of warnings,Reason,Date (YYYY-MM-DD),Expiry - 60 / ∞ / ∅
Epic Gamer,818232693476950026,,"got in trouble for doing pings out of nowhere and being annoying, and then immediately did it again after getting out of <#616700765054042112>",2021-03-28,
☭brom.noski☭,669210396552462367,,Noncompliance when asked to speak English.,2021-03-29,
Tuxedo Stormtrooper,743008811253497897,,"Nazi meme about gas chambers in <#324642291044057099>, flippant attitude in roleban.",2021-03-29,
Tuxedo Stormtrooper,743008811253497897,,Attitude persists.,2021-03-29,
DemonPumpkin,200021118973771778,,"Persistant poor behaviour in <#324642291044057099>, did not cooperate with staff.",2021-03-29,
DemonPumpkin,200021118973771778,,"Consistent petulance after last warning, did not comply while in roleban",2021-03-29,
DivineTerror1605,808256878907490345,,Suspicious link,2021-03-29,
Not a serial killer,629768654342455347,,School shooting jokes,2021-03-29,
DUM!!FRENCH FRI,819269230700527627,,Server advertising.,2021-03-30,
ShaftDuck,458657641732767754,,Random shitposting in <#120330239996854274>,2021-03-30,
BigchickenGod,825188128431800342,,Deliberately posting memes in <#120330239996854274> after being told not to because they were 'bored'.,2021-03-31,
Morty Smith,743148052126105602,,I was going to just let them off with a slap on the wrist for shitposting in <#120330239996854274> but then they started being a smarmy shit about it in <#616700765054042112>,2021-04-01,
Error sans,711289021065592912,,roleplaying,2021-04-01,
sugoi 4213,822831159104634931,,Everyone ping.,2021-04-01,
Atlas,74768773940256768,,weeb,2021-04-01,
Not Sarge,699900942237302814,,derailing / posting random messages and trying to hide that with quick delete,2021-04-01,
Mak-Mak,212578118894878730,,Sexual harassment.,2021-04-02,
Mephone4,798990486035234837,,Attempting to everyone ping a second time even when told not to do it,2021-04-02,
Phoenix Wright,550378533361549313,,Posting a client-crashing video,2021-04-05,
【ｒｉｖｅｒ　ｍａｎ】,750580859538636902,,using spoilers to make a 'fake slur' joke,2021-04-06,
ULBR Team,822064251547025428,,derailing,2021-04-07,
Wotterwot,829306974285987841,,spam in home,2021-04-07,
TheokAudreyYES_E,825057888576864256,,posting the same video 6 times in trashcan,2021-04-08,
Halo? Stupid?,746026052060446811,,"Emoji spam, persisted after being told to stop by about half the staff team.",2021-04-09,
Halo? Stupid?,746026052060446811,,Noncooperative troll.,2021-04-09,
Asriel Dreemur,774281227980505158,,"posting text art and getting told not to do that, then later on spammed my DMs with text art",2021-04-09,
MagnusTheAmogus,689921085025681526,,Everyone ping because they thought that was allowed for some reason.,2021-04-09,
Schrödinger's cat,775962746926923778,,Two NSFW memes.,2021-04-11,
TheokAudreyYES_E,825057888576864256,,spam,2021-04-11,
Sans.,817098211050258433,,Posting 'when the impostor is sus' text art again after being told not to,2021-04-11,
ashwen,692871534989279302,,Being a creep during a discussion in Newhome about sexuality long after it actually ended.,2021-04-12,
! riskTheGod777,527687289850298368,,all caps spam,2021-04-12,
cool dad,474999206298386436,,emote spam,2021-04-13,
Nuke,817659992168464404,,Liveblogging in <#194627177013182465> even after being told multiple times to move it to <#150690836349321217>.,2021-04-14,
cool dad,474999206298386436,,NSFW post in Trashcan.,2021-04-14,
Razor,510992923932753940,,"Meme with slurs, no remorse.",2021-04-14,
sans undertale,580183598494384149,,Random emojis and such in Newhome after being told not to roleplay.,2021-04-14,
pvpplayer_5000,830582707867615244,,Kept derailling and talking gibberish after being told twice to stop by Meagus.,2021-04-15,perma ∞
c0oLsKeLeToN95,830040421769674802,,"Roleplaying after being told to stop, kept roleplaying while rolebanned.",2021-04-15,
Paradox,797577550762868746,,"Rude, noncooperative in roleban.",2021-04-15,
Paradox,797577550762868746,,Repeatedly trying to derail <#507736422556631040>.,2021-04-15,
Ϟ 𝕿𝖍𝖊 𝕾𝖊𝖗𝖎𝖆𝖑 𝕶𝖎𝖑𝖑𝖊𝖗 ★,515541798722994187,,randomly pinging a user for no reason,2021-04-16,
117_spartan,796942320498769950,,"Vaccine misinformation in chat, refused to stop when asked by staff.",2021-04-17,
Pokémon420,412594516663468032,,Mushrooms pics in general. As in drugs,2021-04-18,
alius,924753712788947024,,Made jokes about someone's dead relative,2021-04-19,
ᴋɪᴛᴛʏᴏᴜᴤ,304760808309522435,,Failure to remain on-topic in the general chat.,2021-04-20,
𝔾🅾[̲̅O]F̶̂̽Ⓨ,476780091758739477,,server invites,2021-04-20,
ĐȺɌꝀFƗɌɆ,747844395658772550,,Refusal to speak English.,2021-04-21,
Pattoo1234,451799195381268490,,everyone ping / derailing in UT channel,2021-04-21,
sreggin,562425954585280532,,posting nsfw,2021-04-22,
Flowey,756344923904540742,,invited a troll and tried to lie about it,2021-04-22,
BigDsmallA,678227195579334676,,Video post with cropped pornography in it.,2021-04-22,
CodingBoy,736432574808850473,,server invites in DMs,2021-04-23,
3DGB PLAYZ,752151207472005121,,Chain spam in <#194627177013182465> and <#120330239996854274>.,2021-04-25,
Fusion,826438999823482890,,Chain spam in <#194627177013182465> and <#120330239996854274>.,2021-04-25,
President Obama,314119767625695251,,"Spamming one meme repeatedly, backtalk when told to stop by staff.",2021-04-25,
[TCF] Copper Wire Gaming 2.0,713377945057493032,,Telling smol to kill herself.,2021-04-26,
🧡Tohru🧡,792050398260887562,,Copypastas ,2021-04-26,
BionicProJJ,629489730345500684,,meme riddled with slurs,2021-04-26,
e.,725780249987645470,,everyone ping with fake copypasta warning,2021-04-27,
nithmare,774657718350905355,,spammed pictures of sans in home,2021-04-28,
Tem,658589816098914314,,everyone ping attempt,2021-04-28,
Wind,607555977797173269,,Graphic of a Flareon being shoved into a blender.,2021-04-29,
🪓🖤𝙷𝚘𝚛𝚛𝚘𝚛🖤🪓,719780721534697564,,Tit bait mp4,2021-04-29,
Bacon25,784522175322914856,,Spam,2021-04-30,
🆂🅰🅽🆂,718404881060462612,,Continued roleplay in <#506854523818475531>,2021-05-01,
Highborg Alpha,764160376417812490,,Continued roleplay in <#506854523818475531>,2021-05-01,
RedIsSus,837525190031179816,,Server shilling in Newhome.,2021-05-01,
FrancOis,757950569972367360,,server invite spam,2021-05-02,
lemon demon,819318708396490773,,Spamming random bullshit after being told to stop.,2021-05-03,
CrossEzioSilent,837181546217078824,,Art thief.,2021-05-04,
TheGodOfAr0n,795534596035837963,,server advertising,2021-05-04,
DashOfgames45,828984738181283890,,"Repeated derails in Newhome, refused to comply when told to stop by staff.",2021-05-04,
Blaziken Enthusiast,641017202971115530,,Incest NSFW meme in <#324642291044057099>.,2021-05-05,
the_giver_of_bad_times,687512591555231757,,NSFW meme in <#324642291044057099>.,2021-05-05,
ender man in the rain,770023024891133993,,Continued discussion of piracy.,2021-05-05,
wethole,498353807101788170,,Defense of child abuse.,2021-05-05,
jaki,292762496740229120,,Defense of child abuse.,2021-05-05,
wethole,498353807101788170,,Rape joke that was deleted to avoid punishment.,2021-05-05,
wethole,498353807101788170,,Defense of pedophilia.,2021-05-05,
❤frisk❤,824355915179491388,,"Spam, rolebanned and told to stop, continued.",2021-05-05,
❤frisk❤,824355915179491388,,Same spam again.,2021-05-05,Perma ∞
❤frisk❤,824355915179491388,,Same unsourced art they were told to source before.,2021-05-06,
Wafel,685363951793602573,,Spamming “ok”.,2021-05-06,
Wotterwot,829306974285987841,,Major dead chat spam.,2021-05-07,
P4G3 N0T F0UND,777079076228694026,,Everyone ping,2021-05-07,
P4G3 N0T F0UND,777079076228694026,,Trollish behavior on purpose.,2021-05-07,
RaDsKeLeToN97,782416633553616916,,"Suspiciously fetish-seeming RP, didn't stop when told to.",2021-05-07,
Tasha,834889120836747276,,Attempted everyone ping,2021-05-08,
THEHAM,600413679888105497,,Incest.,2021-05-10,
THEHAM,600413679888105497,,"Trying to get themselves banned and...uh, trying to become a martyr?",2021-05-10,
DABAMBOOZLER,754509586412863526,,inappropriate meme,2021-05-10,
kingrain,841327285599600680,,Spam.,2021-05-10,
kingrain,841327285599600680,,Derailing when told to stop.,2021-05-10,
`kreâx'🍭,376761172525056000,,Repeated shilling,2021-05-11,
The_Blue_One,783378658323726407,,"Child porn joke, feigned stupidity when questioned.",2021-05-11,
roy_-¯,734861851174633554,,"Ableist meme, inappropriate status",2021-05-11,
roy_-¯,734861851174633554,,Homophobic meme,2021-05-11,
Midnight.,781816231883571210,,Pinging a role for no reason,2021-05-11,
Lemon,761865142018244621,,Slur baiting.,2021-05-12,
trapjaw ant,625374352938106894,,Disruptive behaviour in <#194627177013182465>,2021-05-12,
Pattoo1234,451799195381268490,,Spam.,2021-05-12,
G̸̀͘a̴̋́s̵̯̑t̴̨̋e̵͑͑r̸̲͛.̴̬̓,814446359431479316,,Repeated gasterspeak,2021-05-13,
Error!Sans,777464557153157160,,posted very borderline lewd art of Chara,2021-05-13,
roy_-¯,734861851174633554,,Transphobic rhetoric in meme,2021-05-14,
JJ Thomson,739622988718014484,,Ping harassment,2021-05-14,
Niels Bohr,835659219687571486,,Deliberately posting against the suggestions of a staff member.,2021-05-14,
(potato) uɐɯɹǝqop ǝɥʇ uɐʇᴉʇ-chan,702244158223679631,,Spam.,2021-05-16,
bakidogus,827139611256029214,,Sexual comments in newhome,2021-05-16,
NotPika,831301072328720454,,Suicide jokes,2021-05-16,
tdH,690512932647338004,,Emote spam,2021-05-16,
brandonty,801931706344013844,,NSFW comic in art share,2021-05-18,
Bolt,827334650070302730,,"Posting a video of a child getting horribly beaten as a """"""joke""""""",2021-05-19,
chimkin nuget,825842403297984523,,Trying to post animal scat after being told not to.,2021-05-19,
Pandoro-Horñy,844190851282239529,,Continued roleplay after being told to stop.,2021-05-19,
Chara Dreemurr,841183219315769385,,Continued roleplay after being told to stop.,2021-05-19,
Spicy meme merchant,842136429135659059,,reposting the same fuckin meme with a suggestive thumbnail that this guy got warninged for posting like 2 days ago,2021-05-19,
L--l__s a v a g e__l--L,796028288954793989,,Repeated shilling in people's DMs,2021-05-19,
!TheHammerBreake,283614126624866305,,Slurs in VC,2021-05-19,
kamaitachi,218032788849295360,,Fetish art,2021-05-20,
kirbo,476522430689705985,,"Contextless images outside of trashcan, talked back when told to relocate",2021-05-20,
kamaitachi,218032788849295360,,Memes in newhome after being told to stop.,2021-05-20,
Chara Animates,674463869816799243,,Laser girl meme.,2021-05-20,
Ethanpro5567,750368072237449226,,"Rapid breaking of rules, claims he ""forgot the rules"".",2021-05-20,
Shadow Hugo,632196860324610050,,DM harassment of a server member after seeking them out here.,2021-05-21,
epic gamerz,745535029353906246,,Repeated violation of rule 3.,2021-05-22,
Tainy,228630207320293386,,Trying to venerate the act of piracy,2021-05-22,
TemporalHopr,576839079182991380,,spam,2021-05-23,
TheRealGametabs,671366658170028033,,Fake ping spam in multiple channels after being told to stop by staff.,2021-05-23,
BelovedLion,780975301161123880,,spam,2021-05-24,
Nixiation,779838414362116136,,spam,2021-05-24,
Toasty,491823163378761748,,Consistent Inflammatory/trollish behaviour in <#507736422556631040>.,2021-05-24,
Plush_Sonic.Official,846146785147748362,,deliberately shitposting outside of <#324642291044057099>.,2021-05-24,
༺ƤŘØŦØŦ¥Ƥ€༻,731441259763335248,,"Joking about eating people's pets, violation of rule 3, and then being snarky when told to stop.",2021-05-24,
( 𒅒sans𒅒 ),826430279027261490,,RP/harassment in newhome,2021-05-24,
brandon the artist/coder/furry,801931706344013844,,"Unsolicited invites in DMs, freaked out in roleban.",2021-05-24,
( 𒅒sans𒅒 ),826430279027261490,,Random emote spam after being told to stop.,2021-05-25,
FLOOF KIRBURGER,320678460378972162,,Repeated NSFW art posts after being told to stop by staff in roleban.,2021-05-25,
ECHO-ECHO,764105607488733206,,"Joking about eating people's pets, violation of rule 3.",2021-05-26,
Zelo?,458444313295192065,,Suggestive content in <#771928154209386516>.,2021-05-27,
NightmareBadTime,767215399191707680,,Art theft,2021-05-27,
zerosuitkitty,821594698535665695,,Jokes about the explosion in Beirut,2021-05-28,
MisterFyre,435193170213470211,,Repeated derails in Newhome for unrelated Undertale quotes or comments.,2021-05-28,
MisterFyre,435193170213470211,,consistant poor behaviour in <#324642291044057099>,2021-05-28,
Storyfell.Chara,843663328685064262,,Roleplaying / asserted they were Actually The Real Chara when told to stop,2021-05-29,
YaBoiLeo705,596823064436801546,,baiting,2021-05-29,
aloneplane,830629404018343946,,Everyone pings and trolling <#120330239996854274>.,2021-05-29,
MisterFyre,435193170213470211,,continued vapidposting even when told not to,2021-05-29,
Parkdum,219275419663335434,,"NSFW memes in <#324642291044057099>, then poorly trying to defend it.",2021-05-30,
Parkdum,219275419663335434,,"NSFW memes in <#324642291044057099>, *still* tried to defend it after getting a warning.",2021-05-30,
bomber001,508059801918636052,,Use of a modified Discord client to see the names of hidden Discord channels.,2021-05-30,
『Greg』,488029239875076097,,Saying ‘That’s nice’ upon learning a rabbit died.,2021-05-30,
mustafadriweech,456853762573729793,,"Rule 3 violation, being disrespect towards others",2021-05-31,
Urqu1d1,624086028537430049,,Repeated suicide jokes in trashcan.,2021-05-31,
NeonPuro,792360379677671435,,Derailing constantly.,2021-06-02,
Flowey,796064115923353640,,Continued RP after being told to stop.,2021-06-02,
BBlock,847076386786377778,,Video spam in Newhome.,2021-06-02,
Genjo,839462426436567060,,repeatedly sharing uncredited art,2021-06-02,
pop rocks,762860407618535426,,Rape joke in newhome,2021-06-03,
Mp5pm,753647394536685568,,"homophobic joke, not taking following roleban seriously",2021-06-03,
Mp5pm,753647394536685568,,"Incessant trolling/vapidposting, learned nothing from their last roleban apparently.",2021-06-03,
Mystery,387290675130925066,,Attempting to ping everyone using a bug.,2021-06-04,Perma ∞
A very annoying doge,722131069469720728,,Deletepolice spam.,2021-06-06,
A very annoying doge,722131069469720728,,More deletepolice spam.,2021-06-06,Perma ∞
A very annoying doge,722131069469720728,,Everyone ping.,2021-06-06,
lolnoober,787926725450530843,,server invites,2021-06-06,
DoctorButtFart,477358157992165379,,"Posted a meme with NSFW content in it, NSFW status.",2021-06-06,
miow,725770235973599303,,"Spamming, even when told not to",2021-06-07,
blogger39,718577869110116362,,Vapidposting in <#843959204062822420>,2021-06-07,
banana_sans646464,734869918662525000,,Everyone ping.,2021-06-07,
3km2k,572036975679242280,,Transphobic meme,2021-06-07,
Funny Valentine ┃23rd President,662814876561047570,,Spam,2021-06-07,
✨CharaTheChill501✨,818590935431774269,,Message unrelated to threads in <#843959204062822420>.,2021-06-07,
eaeaeuo,782950748794781716,,Emote spam,2021-06-08,
Pump,821651371706810378,,NSFW bait meme in <#120330239996854274>.,2021-06-08,
Mima.,749711582166253589,,randomly pinging someone in # threads,2021-06-08,
iAlexander,447487932375498757,,Unrelated messages in <#843959204062822420>,2021-06-08,
Xairon,654322259195854855,,Unrelated messages in <#843959204062822420>.,2021-06-08,
jevil.,516473562803208213,,Random messages.,2021-06-08,
Selever is ok with pinging,750773758582587563,,Random messages.,2021-06-08,
CrissMC,607427120775430174,,Letter spam.,2021-06-08,
helloeybois,673538691536388126,,Mass pinging a user,2021-06-08,
Catareachkon,211976790858530816,,Spam in a thread.,2021-06-09,
yoshi,274654898833063937,,Spam in a thread.,2021-06-09,
Spartior,445233511709016077,,Spam,2021-06-09,
muted,835312186808729642,,"On a user discussing their pet rabbit, repeatedly talked about their desire to *eat* rabbits.",2021-06-09,
Imagine Not Having Happiness,827799388960325673,,Posted a compilation video of people being seriously injured and possibly killed.,2021-06-10,
F̸͐͝ȋ̶͘r̶͆͝é̷̓w̶̄̈ȁ̴̛l̴̎̈l̵͘͠,732794986264789012,,Discussion of piracy in <#506854523818475531>. Repeat offense.,2021-06-10,
yonzin|PERDI A MINHA OUTRA CONTA,852329012377681920,,spam,2021-06-11,
TemporalHopr,576839079182991380,,Shitting themselves over porn / spam,2021-06-11,
NAREKZNS,571069268121223187,,weak anti-lgbt bait to see how folks would react,2021-06-11,
FroppyLol,694015867112915075,,"Emote spam, disruptive behaviour when told to stop.",2021-06-12,
FroppyLol,694015867112915075,,Repeat behaviour.,2021-06-12,permanent ∞
shockinglypog,852839593359179807,,Emote spam a minute after I tossed and warned another for doing so.,2021-06-12,
shockinglypog,852839593359179807,,Emote spam after warn,2021-06-12,
Zee Bee,812612866443182090,,Emote spam derail after told to stop by staff.,2021-06-12,
kzvvy,309499494636978187,,Explicit message and insult to staff immediatel after unroleban.,2021-06-12,
🩸🩸Killer sans🔪🔪,648240846201946163,,Treating roleban like a joke.,2021-06-12,
smirks,697572356943642685,,Said that fat people's lives are worthless.,2021-06-13,
TS!SwapSwap Sans,795321487673786368,,Dead chat posts in Newhome,2021-06-14,
Fade away,726390881661222925,,random emojis in # threads,2021-06-14,
nea,804307121784487946,,spam,2021-06-14,
vinson132170,551584595762741259,,Nazi memes.,2021-06-14,
error,752131416082612274,,Spam in newhome,2021-06-15,
UK Innit (Council 2 idk),735053593543180408,,Unrelated posts in <#843959204062822420>.,2021-06-15,
,,,,,
"ffjskz,",625438130681413642,,Response to 'dont post random shit' was random shit.,2021-06-16,
Distronial,823645572954587198,,Being an unabashed dick to people and making them leave,2021-06-16,
Devito,826071294189371422,,Server ads,2021-06-16,
Icy_Girl🌸💕,829964540979445790,,asking for pirated copy of Undertale,2021-06-16,
Midnight Michiru,339496487102840832,,Custom client usage with deleted message caching.,2021-06-16,
thicno,691674660739219457,,Talking about eating snakes after being told not to make jokes about eating people's pets???,2021-06-17,
tomBi_,698913963173478491,,thinly veiled nsfw meme,2021-06-17,
Sam TD,837128704354287657,,Repeatedly sending nonsense messages.,2021-06-17,
casual gamer b,785290482606800937,,Referring to sexual situations with underage characters.,2021-06-17,
TheOfficialBrave,689586441818472511,,derailing in <#120330239996854274>,2021-06-18,
TheOfficialBrave,689586441818472511,,randomly pinging moderators / other users for next to no reason,2021-06-18,
TheOfficialBrave,689586441818472511,,Honestly trying to get themselves banned at this point,2021-06-18,
AngelBoyHalo,797397165055148052,,Unwarranted rudeness when told to put memes in trashcan,2021-06-18,
Kittenpower4567,631138466301870081,,Spam.,2021-06-18,
Kittenpower4567,631138466301870081,,More spam.,2021-06-18,
F̸̅́i̸̊̑r̴̃̈́e̴͑́w̴͂͝à̸͑l̷͌͗l̸͂̐,732794986264789012,,Saying they kill animals when they’re angry.,2021-06-18,
Schrödinger's cat,775962746926923778,,Nazi meme.,2021-06-18,
Lgbt | Graf,731583933317120162,,tried to lie their way out of needing to properly credit an artwork,2021-06-19,
Simon_34545,707299451663810684,,Constantly tried to post and discuss sexually suggestive content to get a rise out of people,2021-06-19,
Skelord Valley,838983596605046824,,Suicide joke,2021-06-19,
*inspects your cock*,808135848750219296,,Posting multiple images with the sole intent of disgusting people.,2021-06-20,
artemka_2008,765482524729933835,,random emotes in <#843959204062822420>,2021-06-20,
ocean,763356023729422336,,"asked an artist to draw fetish art, boasted about it in <#120330239996854274>",2021-06-20,
Spirit,625487955246579712,,Spamming the Hotel Transylvania mummy in conjunction with ocean,2021-06-20,
ocean,763356023729422336,,Spamming the Hotel Transylvania mummy in conjunction with Spirit,2021-06-20,
Asriel Dreemurr,775854060409454623,,unrelated message in # threads,2021-06-20,
Spirit,625487955246579712,,Suicide threat over a typo,2021-06-20,
Simon_34545,707299451663810684,,Continued to post sexually suggestive/NSFW content,2021-06-20,perma ∞
Nerf~,139114439306641408,,Permawarn for unban,2021-06-21,perma ∞
annoying dog,663439809905164330,,unrelated message in # threads,2021-06-21,
Schrödinger's cat,775962746926923778,,still posting memes breaking trashcan rules,2021-06-21,
Mettaton,779727277742227467,,joining VC just to mic spam,2021-06-21,
☆   𝖘 𝖆 𝖛 𝖆 𝖌 𝖊  ☆,796028288954793989,,unrelated message in # threads,2021-06-21,
..E Y E..,741483320629657714,,posting a message spoilered in a way that looked like a slur,2021-06-23,
🔥Shadow Wolfツ⫝̸,800018671224881183,,everyone ping attempt,2021-06-23,
Asriel,503374992231366666,,racist joke,2021-06-23,
⟨❬ 尺乇乂乇ㄒ ❭〉,856873163115724821,,"Attempted everyone ping, offtopic comment in threads",2021-06-24,
hackerkid120,841348572011036702,,continually arguing about spam in newhome,2021-06-24,
STORYMAKER,611278339986030601,,shitposting in <#120330239996854274> even after being told to keep it in <#324642291044057099> ,2021-06-24,
STORYMAKER,611278339986030601,,NSFW thread.,2021-06-25,
Jonesy.Dalton,635936420770349068,,Film piracy,2021-06-26,
Waffles,769692299910971400,,Everyone ping to draw attention to a Glitchtale stream of all things,2021-06-26,
jacob ♡,387708202919395328,,Worst possible form of lyricsposting,2021-06-26,
sans_drip,827039619374776332,,rape jokes,2021-06-27,
LordGingy,369020051354812416,,Trying to spam tenor gifs,2021-06-27,
HamleciPRO,846686410769694770,,Tried to evade the invite auto-delete by putting the invite in a thread,2021-06-27,
HamleciPRO,846686410769694770,,Continuing to send server invites -- in my DM's this time,2021-06-27,perma ∞
Sans the funny boi,599318231903109130,,Roleplaying after being told to stop by staff.,2021-06-27,
victoryrobot121,746280068153737319,,"Dead chat in Newhome and Home, then followed up again in roleban",2021-06-27,permanent ∞
victoryrobot121,746280068153737319,,"Refused to take Roleban seriously, arguing semantics.",2021-06-27,
_piscina_de_bolas_,832313292387123251,,Constant derailing/vapidposting,2021-06-27,
pollo con papaya,707873752641306634,,Random posts in <#194627177013182465>,2021-06-28,
pollo con papaya,707873752641306634,,Random posts in <#194627177013182465>,2021-06-28,
Dr. Nefario,770168742394986506,,"RP, crasher gif",2021-06-28,
Yui,517482006301638676,,Extremely aggressive/Harassment comments towards a user,2021-06-29,
Warranty Specialist,738905841562026004,,Being a jerk to other users regarding their art medium,2021-06-30,
SandSpaper,842892898911125545,,off topic stuff in newhome.,2021-06-30,
san's,772171685561761843,,off topic shit in newhome.,2021-06-30,
san's,772171685561761843,,more off topic posts.,2021-06-30,
TU DIOS DRIFT TE EXTERMINA,857643382917955604,,Spam.,2021-06-30,
🍀‖rolbixcrac_yt‖🍀,428250641471766528,,Spam,2021-07-01,
█████,834487599455273001,,untypable name.,2021-07-01,
█████,834487599455273001,,Shitposting outside of <#324642291044057099>.,2021-07-01,
beeg,772889970616565781,,"Known raider of other servers with things such as pedophilic remarks and spamming slurs, then bragging about it in <#120330239996854274>.",2021-07-01,
Nomad,271742223249309696,,Random bullshit.,2021-07-01,
Pan Chitpost,776851290767884329,,Spam,2021-07-02,
MaceLaw,556853302697132052,,Off topic post in <#843959204062822420>,2021-07-02,
November. Jpeg,743517510350930021,,"disgusting, somewhat racist trashcan post.",2021-07-02,
Mukuro İkusaba Pie✭,697134442317086813,,Discriminatory comments in Newhome.,2021-07-03,
alius,924753712788947024,,Inappropriate DM's towards users,2021-07-03,
Facemask,814595696933470329,,joined with an alt just to roleplay,2021-07-03,
Slovakian Princess,756668403380387942,,Off topic post in <#843959204062822420>,2021-07-03,
Creator of Sex and CEO of Roblox,605492152654364694,,Ñ spam.,2021-07-04,
DieuDeamon,668093607311441930,,spoke French right after being told this is English-only server,2021-07-04,
Nightmare  Sans ☆,844684703066882089,,Spam,2021-07-04,
Martin,772171685561761843,,Spam,2021-07-04,
Sans the funny boi,599318231903109130,,Unsolicited invites,2021-07-04,
BelovedLion,780975301161123880,,"Amogus spam. It's against the rules in trashcan, you should know better, and there's a fuckign thread for it.",2021-07-05,
vibhavgs,856823964231794699,,Emoji spam.,2021-07-05,
notausername8910,851685189499617280,,sexual assault references in <#324642291044057099>,2021-07-06,
lux_lrl,565231873685717024,,9/11 jokes,2021-07-06,
STORYMAKER,611278339986030601,,Joking about sexual abuse.,2021-07-07,
ENA,825635700263092235,,NSFW bait.,2021-07-07,
Ivanthemadlad,374353736060895232,,Animal abuse video.,2021-07-07,
𝚖𝚘𝚜𝚑𝚒||hehe,539850415324528650,,"Alluding to saying slurs, especially in an inappropriate context.",2021-07-08,
Sir Butter,508136482171781123,,Porn bait meme.,2021-07-08,
Sir Butter,508136482171781123,,"Trolling about how God is the horny police after posting a porn bait meme, even once rolebanned.",2021-07-08,
glance,852598756980555776,,"spam, joking about death.",2021-07-09,
Wy Gaming,808113454568701972,,everyone ping attempt,2021-07-09,
El Alex,728000897543831703,,NSFW joke question in newhome,2021-07-09,
Jonesy.Dalton,635936420770349068,,Racist joke,2021-07-10,
zeed,677083827369148429,,Antagonizing other users.,2021-07-10,
『 𝐙𝐨𝐦𝐤𝐚 』,566649294694645793,,shitposting in newhome,2021-07-10,
Taco swtor player,850127735409868820,,More unsolicited dms.,2021-07-10,
si,780549385905242163,,That squiggly N thing that Latin American YouTube is doing,2021-07-11,
Decimator,839831752541470751,,messages in wingdings after being told not to do it,2021-07-12,
darrila,770431985570283521,,invites in DMs,2021-07-13,
The Great Papyrus,707244846699642941,,Roleplaying in <#120330239996854274>,2021-07-13,
